slug,name,category,path,description,priority,compatibility
engineer-to-founder,engineer-to-founder,founder-led,skills/founder-led/engineer-to-founder/SKILL.md,"Translate engineering strengths into founder-led GTM: customer discovery, positioning, demos, technical proof, founder sales habits, and first repeatable motion. Use when a technical founder needs to sell, do customer interviews, explain value without feature dumping, or build GTM confidence.",medium,"Claude Code, Cursor, Codex, Hermes, Windsurf, OpenCode, Gemini CLI, Copilot, Zed, VS Code, Goose"
equity-management,equity-management,founder-led,skills/founder-led/equity-management/SKILL.md,"Complete equity management for SaaS founders — cap tables, 409A valuations, option pools (ISO vs NSO vs RSU), 83(b) elections, equity grants for employees/advisors/contractors, dilution modeling, secondary sales, and equity tools (Carta, Pulley, AngelList Equity). Use when setting up equity, granting options, planning option pools, modeling dilution, or preparing for fundraising. Triggers on: ""cap table"", ""409A valuation"", ""option pool"", ""equity grant"", ""ISO vs NSO"", ""83(b)"", ""equity for employees"".",medium,"Claude Code, Cursor, Codex, Hermes, Windsurf, OpenCode, Gemini CLI, Copilot, Zed, VS Code, Goose"
events-planning,events-planning,founder-led,skills/founder-led/events-planning/SKILL.md,"Plan and execute B2B events — conferences, webinars, dinners, happy hours, trade shows, and owned events. Use when planning any business event to generate pipeline or build community. Triggers on: ""event planning"", ""plan event"", ""host webinar"", ""conference strategy"", ""trade show"", ""customer dinner"", ""happy hour"", ""launch event"", or any event-related request.",medium,"Claude Code, Cursor, Codex, Hermes, Windsurf, OpenCode, Gemini CLI, Copilot, Zed, VS Code, Goose"
exiting-company,exiting-company,founder-led,skills/founder-led/exiting-company/SKILL.md,"Prepare a SaaS company for acquisition or exit — valuation drivers by buyer type (strategic, PE, bootstrap), due diligence readiness, EBITDA vs ARR multiples, and 12–24 month exit timeline. Use when planning an exit, preparing for acquisition, or maximizing company value for a future sale. Triggers on: ""exit strategy"", ""sell company"", ""acquisition prep"", ""M&A"", ""due diligence"", ""company valuation"", ""exit planning"", ""PE acquisition"", ""bootstrap exit"".",medium,"Claude Code, Cursor, Codex, Hermes, Windsurf, OpenCode, Gemini CLI, Copilot, Zed, VS Code, Goose"
financial-modeling,financial-modeling,founder-led,skills/founder-led/financial-modeling/SKILL.md,"SaaS financial modeling for founders — operating model, runway, headcount, DCF valuation, consumption-based pricing models, cohort analysis, unit economics by segment, ARR bridge/build, 3-scenario forecasting, and board-ready financials. Use when building financial model, projecting runway, modeling fundraising, valuation, or planning headcount. Covers discounted cash flow, consumption revenue models, expansion modeling, and SaaS-specific valuation.",medium,"Claude Code, Cursor, Codex, Hermes, Windsurf, OpenCode, Gemini CLI, Copilot, Zed, VS Code, Goose"
first-hires-playbook,first-hires-playbook,founder-led,skills/founder-led/first-hires-playbook/SKILL.md,"Complete playbook for founder's first 10 hires beyond sales. Use when hiring first engineer, first CS, first marketer, first product manager, or building founding team. Covers when to hire each role, job description architecture, compensation benchmarking, interview process design, and offer construction.",medium,"Claude Code, Cursor, Codex, Hermes, Windsurf, OpenCode, Gemini CLI, Copilot, Zed, VS Code, Goose"
founder-brand,founder-brand,founder-led,skills/founder-led/founder-brand/SKILL.md,"Build a founder personal brand — LinkedIn strategy, content cadence, podcast guesting, newsletter growth, media features, and community building. Includes Adam Robinson's (RB2B) founder-led LinkedIn playbook: daily posting, hooks, zero-click content, and build-in-public. Use when building personal brand, growing audience, or establishing thought leadership as a founder. Triggers on: ""personal brand"", ""founder brand"", ""LinkedIn strategy"", ""thought leadership"", ""build audience"", ""build in public"", ""Adam Robinson"", ""get on podcasts"", ""newsletter growth"", or any founder content request.",medium,"Claude Code, Cursor, Codex, Hermes, Windsurf, OpenCode, Gemini CLI, Copilot, Zed, VS Code, Goose"
founder-comp-playbook,founder-comp-playbook,founder-led,skills/founder-led/founder-comp-playbook/SKILL.md,"Founder guide to GTM compensation — what you can afford, how to set OTE and equity, budget guardrails, valuing packages for candidates, and negotiation scripts when cash is tight. Covers hiring first AE/SDR/VP and founder-side offer/counter-offer tactics. Use when a founder asks how to comp sales hires, negotiate offers, explain equity, or defend quota math. Triggers on: ""founder comp"", ""how much to pay first AE"", ""negotiate sales offer as founder"", ""comp budget startup"", ""what equity to offer"", ""candidate wants more money"", ""can't afford VP Sales salary"", ""founder hiring compensation"".",medium,"Claude Code, Cursor, Codex, Hermes, Windsurf, OpenCode, Gemini CLI, Copilot, Zed, VS Code, Goose"
founder-sales,founder-sales,founder-led,skills/founder-led/founder-sales/SKILL.md,"Founder-led sales playbook for $0-5M ARR stages. Use when founder is primary seller, building sales process from scratch, transitioning from founder-led to AE-led, or designing demo/negotiation/close motions as a technical founder.",medium,"Claude Code, Cursor, Codex, Hermes, Windsurf, OpenCode, Gemini CLI, Copilot, Zed, VS Code, Goose"
fundraising-strategy,fundraising-strategy,founder-led,skills/founder-led/fundraising-strategy/SKILL.md,"Complete fundraising strategy for B2B SaaS founders. Use when preparing to raise seed/Series A, deciding VC vs bootstrapped path, building pitch deck, running a fundraise process, evaluating term sheets, or planning fundraising timeline. Covers SAFE, priced rounds, and bootstrapper alternatives.",medium,"Claude Code, Cursor, Codex, Hermes, Windsurf, OpenCode, Gemini CLI, Copilot, Zed, VS Code, Goose"
gtm-recruiting,gtm-recruiting,founder-led,skills/founder-led/gtm-recruiting/SKILL.md,"GTM recruiting playbook — active sourcing, passive candidate outreach, offer negotiation, recruiter partnerships (Betts, It's Destiny Recruiting), and inclusive hiring without tokenization. Use when recruiting SDR/AE/CS/leaders, closing candidates, negotiating OTE/equity, or building diverse GTM benches. Triggers on: ""recruit salesperson"", ""negotiate offer"", ""close candidate"", ""Betts recruiting"", ""diversity hiring sales"", ""passive candidate outreach"", ""sales offer negotiation"", ""contingency recruiter"", ""Destiny recruiting"".",medium,"Claude Code, Cursor, Codex, Hermes, Windsurf, OpenCode, Gemini CLI, Copilot, Zed, VS Code, Goose"
gtm-role-descriptions,gtm-role-descriptions,founder-led,skills/founder-led/gtm-role-descriptions/SKILL.md,"GTM job descriptions, org structure, and compensation — role-by-role JD templates, revenue org charts by ARR stage, OTE/quota/comp plans, and posting channels. Includes GTM Engineer hiring (vs RevOps, SE, Growth Engineer). Grounded in Betts Recruiting, Bridge Group, RepVue, Pavilion, and Winning by Design POD design. Use when writing a job description, designing revenue org structure, setting sales comp, or hiring SDR/AE/RevOps/GTM Engineer/CS/Marketing roles. Triggers on: ""job description"", ""JD for"", ""write a job post"", ""sales comp plan"", ""OTE quota"", ""revenue org chart"", ""hire SDR"", ""hire AE"", ""VP Sales job description"", ""RevOps role"", ""GTM Engineer"", ""hire GTM engineer"", ""org structure GTM"".",medium,"Claude Code, Cursor, Codex, Hermes, Windsurf, OpenCode, Gemini CLI, Copilot, Zed, VS Code, Goose"
hiring-agencies,hiring-agencies,founder-led,skills/founder-led/hiring-agencies/SKILL.md,"Evaluate, hire, and manage GTM agencies — outbound, RevOps/Clay, demand gen, design, and dev shops. Agency vs in-house decision framework, pilot structure, scorecards, kill switches, and handoff to internal teams. Use when outsourcing GTM execution, evaluating an outbound agency, or deciding agency vs first hire. Triggers on: ""hire agency"", ""outbound agency"", ""GTM agency"", ""Clay agency"", ""RevOps agency"", ""agency vs in-house"", ""outsource GTM"", ""marketing agency"", ""dev shop"", ""manage agency"".",medium,"Claude Code, Cursor, Codex, Hermes, Windsurf, OpenCode, Gemini CLI, Copilot, Zed, VS Code, Goose"
hiring-by-role,hiring-by-role,founder-led,skills/founder-led/hiring-by-role/SKILL.md,"Role-specific hiring guides for B2B SaaS — interview questions, evaluation criteria, scorecards, and assessment methods for engineering, sales, marketing, customer success, product, and design roles. Based on best practices from Betts Recruiting, Bridge Group, SaaStr, YC, and Google re:Work. Use when building an interview process for a specific role or evaluating candidates systematically. Triggers on: ""interview questions for [role]"", ""how to hire [role]"", ""scorecard for [role]"", ""evaluate [role] candidates"".",medium,"Claude Code, Cursor, Codex, Hermes, Windsurf, OpenCode, Gemini CLI, Copilot, Zed, VS Code, Goose"
hiring-contractors,hiring-contractors,founder-led,skills/founder-led/hiring-contractors/SKILL.md,"Hire and manage contractors for SaaS startups — where to find them, how to structure engagements, IP assignment, rates by role, and management practices that produce quality work without full-time overhead. Use when hiring freelance developers, designers, writers, or any contract talent. Triggers on: ""hire contractor"", ""freelance developer"", ""contract work"", ""outsource development"", ""find a designer"", ""contract vs employee"", or any contractor hiring request.",medium,"Claude Code, Cursor, Codex, Hermes, Windsurf, OpenCode, Gemini CLI, Copilot, Zed, VS Code, Goose"
investor-updates,investor-updates,founder-led,skills/founder-led/investor-updates/SKILL.md,"Write investor updates that build confidence and surface help — monthly format, board deck structure, fundraising narrative, and metrics dashboards. Use when writing investor updates, preparing board meetings, or communicating with stakeholders. Triggers on: ""investor update"", ""board deck"", ""monthly update"", ""investor communication"", ""fundraising update"", or any stakeholder reporting.",medium,"Claude Code, Cursor, Codex, Hermes, Windsurf, OpenCode, Gemini CLI, Copilot, Zed, VS Code, Goose"
job-posting-strategy,job-posting-strategy,founder-led,skills/founder-led/job-posting-strategy/SKILL.md,"Complete job posting and distribution strategy for B2B SaaS companies — where to post by role (engineering, sales, marketing, CS, product, design), job board comparison, posting templates, sourcing channels, and expert recruiting strategies. References Betts Recruiting, SaaStr, YC, and Bridge Group data. Use when hiring for any role and determining where to find the best candidates. Triggers on: ""job posting"", ""where to post jobs"", ""job boards"", ""recruiting strategy"", ""sourcing candidates"".",medium,"Claude Code, Cursor, Codex, Hermes, Windsurf, OpenCode, Gemini CLI, Copilot, Zed, VS Code, Goose"
launch-planning,launch-planning,founder-led,skills/founder-led/launch-planning/SKILL.md,"Plan product and feature launches across owned, earned, community, partner, and outbound channels. Produces launch narrative, audience map, asset checklist, channel calendar, risk plan, and measurement dashboard. Use when launching a startup, feature, campaign, Product Hunt post, or category narrative.",medium,"Claude Code, Cursor, Codex, Hermes, Windsurf, OpenCode, Gemini CLI, Copilot, Zed, VS Code, Goose"
lead-magnets,lead-magnets,founder-led,skills/founder-led/lead-magnets/SKILL.md,"Create lead magnets that convert qualified buyers: calculators, checklists, teardown offers, templates, benchmarks, reports, and free tools. Produces concept shortlist, landing page outline, capture flow, nurture path, and qualification logic. Use when building demand capture assets or content-to-pipeline offers.",medium,"Claude Code, Cursor, Codex, Hermes, Windsurf, OpenCode, Gemini CLI, Copilot, Zed, VS Code, Goose"
legal-for-founders,legal-for-founders,founder-led,skills/founder-led/legal-for-founders/SKILL.md,"Complete legal playbook for SaaS founders — incorporation (Delaware C-Corp vs LLC), IP assignment, Terms of Service, Privacy Policy, NDAs, consulting agreements, co-founder IP, fundraising legal (SAFE, priced round, board consents), and when to hire a lawyer. Step-by-step checklists with YC, CooleyGO, Clerky, and Orrick resources. Triggers on: ""legal for startup"", ""incorporate"", ""Terms of Service"", ""Privacy Policy"", ""NDA"", ""SAFE"", ""startup legal"", ""founder legal basics"".",medium,"Claude Code, Cursor, Codex, Hermes, Windsurf, OpenCode, Gemini CLI, Copilot, Zed, VS Code, Goose"
partner-programs,partner-programs,founder-led,skills/founder-led/partner-programs/SKILL.md,"Design partner programs for startups: partner ICP, co-marketing offers, referral mechanics, integration partners, attribution, enablement, and compensation. Use when building affiliates, referral partners, ecosystem channels, agencies, or integration-led growth.",medium,"Claude Code, Cursor, Codex, Hermes, Windsurf, OpenCode, Gemini CLI, Copilot, Zed, VS Code, Goose"
pricing-psychology,pricing-psychology,founder-led,skills/founder-led/pricing-psychology/SKILL.md,"SaaS pricing psychology and tactics for B2B founders. Use when designing pricing tiers, testing price points, building pricing pages, handling discounting strategy, adding new pricing dimensions, or optimizing monetization. Covers anchoring, decoy effect, charm pricing, framing, versioning, and willingness-to-pay research methodology.",medium,"Claude Code, Cursor, Codex, Hermes, Windsurf, OpenCode, Gemini CLI, Copilot, Zed, VS Code, Goose"
saas-metrics-calculator,saas-metrics-calculator,founder-led,skills/founder-led/saas-metrics-calculator/SKILL.md,"Calculate and interpret SaaS metrics for founders: MRR, ARR, NRR, GRR, churn, CAC payback, LTV:CAC, burn multiple, Rule of 40, cohort retention, and scenario models. Use when building investor updates, dashboards, board materials, pricing decisions, or growth diagnostics.",medium,"Claude Code, Cursor, Codex, Hermes, Windsurf, OpenCode, Gemini CLI, Copilot, Zed, VS Code, Goose"
saas-outcomes,saas-outcomes,founder-led,skills/founder-led/saas-outcomes/SKILL.md,"SaaS company outcomes — valuation methods, bootstrap vs VC paths, end-goal decision framework, profitable growth vs growth-at-all-costs, secondary sales, and exit timing. Use when choosing bootstrap vs raise, modeling valuation, planning end state, or comparing lifestyle vs venture outcomes. Triggers on: ""SaaS valuation"", ""bootstrap vs VC"", ""end goal"", ""sell vs grow"", ""ARR multiple"", ""bootstrapped exit"", ""venture path"", ""lifestyle business"", ""when to raise"", ""founder journey"", ""stage gates"", ""exit optionality"", ""when to sell"", ""bootstrap founder path"", ""earn-out"", ""lifestyle vs exit bootstrap"".",medium,"Claude Code, Cursor, Codex, Hermes, Windsurf, OpenCode, Gemini CLI, Copilot, Zed, VS Code, Goose"
sales-team-building,sales-team-building,founder-led,skills/founder-led/sales-team-building/SKILL.md,"Build a B2B sales team from first hire to scale — hiring sequence by ARR stage, WbD POD structures, compensation models (linear/accelerated/split), draw mechanics, REKS coaching, and WbD GTM Index for scaling readiness. Use when planning first sales hire, designing sales org, or scaling a team. Triggers on: ""build sales team"", ""first sales hire"", ""sales org design"", ""sales compensation"", ""sales POD"", ""scale sales team"", ""hire AE"", ""hire SDR"", ""SDR economics"", ""Tito Bohrt"", or any sales team building request.",medium,"Claude Code, Cursor, Codex, Hermes, Windsurf, OpenCode, Gemini CLI, Copilot, Zed, VS Code, Goose"
security-assessments,security-assessments,founder-led,skills/founder-led/security-assessments/SKILL.md,"Security assessment and vendor risk management for B2B SaaS — penetration testing, vulnerability scanning, bug bounty programs, security questionnaires (VSAQ/SIG/CAIQ), incident response planning, disaster recovery, and passing enterprise security reviews. Use when responding to vendor security assessments, preparing for enterprise procurement, or building a security program. Triggers on: ""security assessment"", ""penetration test"", ""bug bounty"", ""security questionnaire"", ""VSAQ"", ""incident response"", ""vendor review"".",medium,"Claude Code, Cursor, Codex, Hermes, Windsurf, OpenCode, Gemini CLI, Copilot, Zed, VS Code, Goose"
soc2-compliance,soc2-compliance,founder-led,skills/founder-led/soc2-compliance/SKILL.md,"Achieve SOC2 Type II compliance for SaaS companies — readiness assessment, control implementation, auditor selection, evidence collection, and ongoing monitoring. Use when preparing for SOC2, responding to enterprise security questionnaires, or building a compliance program. Triggers on: ""SOC2"", ""SOC 2"", ""compliance"", ""security audit"", ""enterprise security"", ""security questionnaire"", ""Type II"", or any request about security compliance for SaaS.",medium,"Claude Code, Cursor, Codex, Hermes, Windsurf, OpenCode, Gemini CLI, Copilot, Zed, VS Code, Goose"
solo-founder-gtm,solo-founder-gtm,founder-led,skills/founder-led/solo-founder-gtm/SKILL.md,"Build lean GTM as a solo founder or bootstrapper — tool stacks by revenue stage, AI agents replacing headcount, when to make the first hire, bootstrapper economics, and the WbD GTM Index for self-assessment. Use when building GTM as a solo founder, bootstrapper, or small team. Triggers on: ""solo founder"", ""bootstrapper GTM"", ""lean GTM"", ""founder sales"", ""DIY GTM"", ""when to hire"", ""founder tools"", ""bootstrapped stack"", ""product market fit"", ""PMF test"", ""when to scale"", ""scale too early"", or any request about building GTM without a team.",medium,"Claude Code, Cursor, Codex, Hermes, Windsurf, OpenCode, Gemini CLI, Copilot, Zed, VS Code, Goose"
startup-communities,startup-communities,founder-led,skills/founder-led/startup-communities/SKILL.md,"Use startup communities as a GTM channel without spamming: community selection, trust-building, founder asks, launch posts, feedback loops, and referral capture. Use when entering founder communities, posting launches, finding early adopters, or turning community participation into pipeline.",medium,"Claude Code, Cursor, Codex, Hermes, Windsurf, OpenCode, Gemini CLI, Copilot, Zed, VS Code, Goose"
vc-outreach,vc-outreach,founder-led,skills/founder-led/vc-outreach/SKILL.md,"Plan investor outreach for startups: target investor list, warm intro paths, cold email, update cadence, CRM tracking, meeting prep, and follow-up. Use when raising a round, contacting angels or VCs, building a fundraising pipeline, or improving investor reply rates.",medium,"Claude Code, Cursor, Codex, Hermes, Windsurf, OpenCode, Gemini CLI, Copilot, Zed, VS Code, Goose"
vendor-contracts,vendor-contracts,founder-led,skills/founder-led/vendor-contracts/SKILL.md,"Vendor contracts, MSAs, DPAs, and procurement for B2B SaaS — master service agreements, service level agreements, data processing agreements, order forms, vendor security assessments, and contract negotiation playbooks. Use when selling to enterprise (inbound contracts), buying from vendors (outbound procurement), negotiating terms, or building standard agreement templates. Triggers on: ""MSA"", ""SLA agreement"", ""data processing agreement"", ""order form"", ""vendor security review"", ""enterprise contract"", ""procurement"".",medium,"Claude Code, Cursor, Codex, Hermes, Windsurf, OpenCode, Gemini CLI, Copilot, Zed, VS Code, Goose"
yc-ecosystem,yc-ecosystem,founder-led,skills/founder-led/yc-ecosystem/SKILL.md,"Navigate the public YC ecosystem for founder GTM: company research, batch mapping, outreach angles, application positioning, founder network use, and launch leverage. Use when researching YC companies, preparing YC applications, planning YC-style launch motion, or mapping startup ecosystem opportunities.",medium,"Claude Code, Cursor, Codex, Hermes, Windsurf, OpenCode, Gemini CLI, Copilot, Zed, VS Code, Goose"
churn-prevention,churn-prevention,growth,skills/growth/churn-prevention/SKILL.md,"Build churn prevention systems — early warning signal detection, customer health scoring, re-engagement campaigns, risk tier routing, and champion departure monitoring. Use when reducing churn, building retention systems, detecting at-risk customers, or designing proactive customer success workflows. Triggers on: ""churn prevention"", ""reduce churn"", ""at-risk customers"", ""health score"", ""customer retention"", ""churn prediction"", ""save customers"", ""re-engagement"", or any request about keeping customers from canceling.",medium,"Claude Code, Cursor, Codex, Hermes, Windsurf, OpenCode, Gemini CLI, Copilot, Zed, VS Code, Goose"
customer-marketing,customer-marketing,growth,skills/growth/customer-marketing/SKILL.md,"Customer marketing and advocacy programs — case studies, testimonials, customer reference programs, NPS-driven advocacy, customer communities, user conferences, champion programs, logo usage, and review generation (G2, Capterra). Use when building customer marketing, generating case studies, launching a reference program, or mobilizing customer advocates.",medium,"Claude Code, Cursor, Codex, Hermes, Windsurf, OpenCode, Gemini CLI, Copilot, Zed, VS Code, Goose"
expansion-selling,expansion-selling,growth,skills/growth/expansion-selling/SKILL.md,"Complete expansion and upsell playbook for B2B SaaS — consumption-based upsell triggers, cross-sell identification, seat expansion, tier upgrades, NRR growth strategies, land-and-expand motions, expansion propensity scoring, and measuring expansion revenue. Use when designing expansion motions, identifying upsell opportunities, or growing NRR. Triggers on: ""expansion selling"", ""upsell strategy"", ""NRR growth"", ""land and expand"", ""cross-sell"", ""expansion revenue"", ""seat expansion"".",medium,"Claude Code, Cursor, Codex, Hermes, Windsurf, OpenCode, Gemini CLI, Copilot, Zed, VS Code, Goose"
referral-programs,referral-programs,growth,skills/growth/referral-programs/SKILL.md,"Design customer and partner referral programs — 3-tier comp structure, double-sided incentive design, referral tracking, platform integration, viral mechanics, fraud prevention, and measuring referral revenue against published benchmarks. Use when building a referral program, designing referral incentives, or launching a customer referral engine. Triggers on: ""referral program"", ""referral marketing"", ""customer referrals"", ""partner referrals"", ""double-sided rewards"", ""referral tracking"".",medium,"Claude Code, Cursor, Codex, Hermes, Windsurf, OpenCode, Gemini CLI, Copilot, Zed, VS Code, Goose"
review-platforms,review-platforms,growth,skills/growth/review-platforms/SKILL.md,"B2B review site strategy — G2, Capterra, TrustRadius, Gartner Peer Insights, and Product Hunt. How to collect reviews, respond to negative feedback, rank in categories, and convert review traffic to pipeline. Use when building G2 presence, responding to reviews, review generation campaigns, or competitive review intel. Triggers on: ""G2 reviews"", ""TrustRadius"", ""Capterra"", ""review site strategy"", ""respond to negative review"", ""get more G2 reviews"", ""G2 badge"", ""review generation"".",medium,"Claude Code, Cursor, Codex, Hermes, Windsurf, OpenCode, Gemini CLI, Copilot, Zed, VS Code, Goose"
campaign-governance,campaign-governance,gtm-ops,skills/gtm-ops/campaign-governance/SKILL.md,"Establish campaign governance — naming conventions, UTM parameters, campaign hierarchy, ROI measurement, budget tracking. Triggers on: ""campaign governance"", ""UTM strategy"", ""campaign naming"", ""marketing ops governance"".",medium,"Claude Code, Cursor, Codex, Hermes, Windsurf, OpenCode, Gemini CLI, Copilot, Zed, VS Code, Goose"
gtm-operations,gtm-operations,gtm-ops,skills/gtm-ops/gtm-operations/SKILL.md,"Build a GTM operations / RevOps function — tech stack architecture, process design, data governance, operating cadence, and maturity assessment anchored to Gartner and Forrester research. Use when designing or auditing revenue operations, sales ops, or GTM infrastructure. Triggers on: ""GTM ops"", ""RevOps"", ""revenue operations"", ""sales ops"", ""GTM infrastructure"".",medium,"Claude Code, Cursor, Codex, Hermes, Windsurf, OpenCode, Gemini CLI, Copilot, Zed, VS Code, Goose"
gtm-spend-management,gtm-spend-management,gtm-ops,skills/gtm-ops/gtm-spend-management/SKILL.md,"GTM spend management — Ramp corporate cards, virtual cards per vendor, SaaS vendor roster, tool spend approvals, bill pay, accounting sync, and shadow-IT cleanup. Use when setting up Ramp, governing GTM tool purchases, tracking vendor renewals, or controlling per-rep software spend. Triggers on: ""spend management"", ""Ramp setup"", ""corporate card GTM"", ""vendor spend"", ""SaaS spend governance"", ""tool purchase approval"", ""virtual card per vendor"", ""Brex vs Ramp"", ""zombie subscriptions"", ""vendor roster"".",medium,"Claude Code, Cursor, Codex, Hermes, Windsurf, OpenCode, Gemini CLI, Copilot, Zed, VS Code, Goose"
