slug,name,category,path,description,priority,compatibility
abm-1-to-1,abm-1-to-1,abm,skills/abm/abm-1-to-1/SKILL.md,"Execute Strategic ABM (1-to-1) for 5-15 high-value accounts — custom microsites, executive engagement, direct mail, board-level connections, custom content. Triggers on: ""1-to-1 ABM"", ""strategic ABM"", ""custom ABM"", ""key account marketing"", ""named account"".",medium,"Claude Code, Cursor, Codex, Hermes, Windsurf, OpenCode, Gemini CLI, Copilot, Zed, VS Code, Goose"
abm-1-to-few,abm-1-to-few,abm,skills/abm/abm-1-to-few/SKILL.md,"Execute ABM at Scale (1-to-few) for 15-50 clustered accounts — semi-custom campaigns, industry-specific content, persona-based plays. Triggers on: ""1-to-few ABM"", ""ABM scale"", ""cluster ABM"", ""industry ABM"".",medium,"Claude Code, Cursor, Codex, Hermes, Windsurf, OpenCode, Gemini CLI, Copilot, Zed, VS Code, Goose"
abm-1-to-many,abm-1-to-many,abm,skills/abm/abm-1-to-many/SKILL.md,"Execute Programmatic ABM (1-to-many) for 50-200+ accounts — automated personalization, scaled outbound, lookalike expansion. Triggers on: ""1-to-many ABM"", ""programmatic ABM"", ""scaled ABM"", ""automated ABM"".",medium,"Claude Code, Cursor, Codex, Hermes, Windsurf, OpenCode, Gemini CLI, Copilot, Zed, VS Code, Goose"
abm-strategy,abm-strategy,abm,skills/abm/abm-strategy/SKILL.md,"Design and execute Account-Based Marketing strategy — tier selection, account scoring, channel orchestration, BDR alignment, measurement framework. Triggers on: ""ABM strategy"", ""account based marketing"", ""ABM playbook"", ""design ABM"", ""target accounts"".",medium,"Claude Code, Cursor, Codex, Hermes, Windsurf, OpenCode, Gemini CLI, Copilot, Zed, VS Code, Goose"
account-selection,account-selection,abm,skills/abm/account-selection/SKILL.md,"Select and prioritize target accounts for ABM programs — scoring models, tier assignment, TAM segmentation. Triggers on: ""account selection"", ""target account list"", ""tier accounts"", ""prioritize accounts"", ""TAM segmentation"".",medium,"Claude Code, Cursor, Codex, Hermes, Windsurf, OpenCode, Gemini CLI, Copilot, Zed, VS Code, Goose"
multi-thread-orchestration,multi-thread-orchestration,abm,skills/abm/multi-thread-orchestration/SKILL.md,"Orchestrate multi-threaded ABM engagement across buying committee members — stakeholder mapping, parallel plays, ghost node detection. Triggers on: ""multi-thread"", ""stakeholder map"", ""buying committee"", ""deal mapping"".",medium,"Claude Code, Cursor, Codex, Hermes, Windsurf, OpenCode, Gemini CLI, Copilot, Zed, VS Code, Goose"
agent-architecture,agent-architecture,ai-agents,skills/ai-agents/agent-architecture/SKILL.md,"Design AI agent architectures for GTM workflows — agent patterns, tool selection, multi-agent orchestration, human-in-the-loop. Triggers on: ""agent architecture"", ""AI agent design"", ""agent patterns"", ""multi-agent"", ""agent workflow"".",medium,"Claude Code, Cursor, Codex, Hermes, Windsurf, OpenCode, Gemini CLI, Copilot, Zed, VS Code, Goose"
agent-guardrails,agent-guardrails,ai-agents,skills/ai-agents/agent-guardrails/SKILL.md,"Implement safety guardrails for GTM agents — content filtering, approval gates, rate limiting, budget controls, kill switches. Triggers on: ""agent guardrails"", ""agent safety"", ""AI guardrails"", ""agent controls"", ""agent compliance"".",medium,"Claude Code, Cursor, Codex, Hermes, Windsurf, OpenCode, Gemini CLI, Copilot, Zed, VS Code, Goose"
agent-observability,agent-observability,ai-agents,skills/ai-agents/agent-observability/SKILL.md,"Monitor and debug AI agent performance — logging, metrics, alerting, cost tracking, error analysis. Triggers on: ""agent monitoring"", ""agent observability"", ""agent analytics"", ""agent logging"", ""agent debug"".",medium,"Claude Code, Cursor, Codex, Hermes, Windsurf, OpenCode, Gemini CLI, Copilot, Zed, VS Code, Goose"
agent-tool-calling,agent-tool-calling,ai-agents,skills/ai-agents/agent-tool-calling/SKILL.md,"Design agent tool-calling strategies — MCP servers, API integration, function calling, tool selection logic. Triggers on: ""agent tools"", ""MCP server"", ""tool calling"", ""function calling"", ""agent API integration"".",medium,"Claude Code, Cursor, Codex, Hermes, Windsurf, OpenCode, Gemini CLI, Copilot, Zed, VS Code, Goose"
1p-tagging-pixels,1p-tagging-pixels,analytics,skills/analytics/1p-tagging-pixels/SKILL.md,"Set up first-party tracking and analytics — website pixels, conversion tracking, UTM architecture, cookie consent, server-side tagging vs client-side, 1P vs 3P data strategy, and identity resolution. Use when setting up tracking, implementing pixels, building attribution, or preparing for privacy-first measurement. Triggers on: ""pixel"", ""tracking"", ""conversion tracking"", ""first-party data"", ""server-side tagging"", ""UTM"", ""cookie consent"", ""1P vs 3P"", ""identity resolution"", or any tracking implementation request.",medium,"Claude Code, Cursor, Codex, Hermes, Windsurf, OpenCode, Gemini CLI, Copilot, Zed, VS Code, Goose"
a-b-testing,a-b-testing,analytics,skills/analytics/a-b-testing/SKILL.md,"A B Testing playbook for GTM agents — strategy, workflow, templates, operating guidance, and quality checks. Use when the user asks for a b testing work, implementation help, or an agent-ready deliverable.",medium,"Claude Code, Cursor, Codex, Hermes, Windsurf, OpenCode, Gemini CLI, Copilot, Zed, VS Code, Goose"
attribution,attribution,analytics,skills/analytics/attribution/SKILL.md,"Attribution playbook for GTM agents — strategy, workflow, templates, operating guidance, and quality checks. Use when the user asks for attribution work, implementation help, or an agent-ready deliverable.",medium,"Claude Code, Cursor, Codex, Hermes, Windsurf, OpenCode, Gemini CLI, Copilot, Zed, VS Code, Goose"
campaign-analytics,campaign-analytics,analytics,skills/analytics/campaign-analytics/SKILL.md,"Campaign Analytics playbook for GTM agents — strategy, workflow, templates, operating guidance, and quality checks. Use when the user asks for campaign analytics work, implementation help, or an agent-ready deliverable.",medium,"Claude Code, Cursor, Codex, Hermes, Windsurf, OpenCode, Gemini CLI, Copilot, Zed, VS Code, Goose"
deliverability-monitoring,deliverability-monitoring,analytics,skills/analytics/deliverability-monitoring/SKILL.md,"Deliverability Monitoring playbook for GTM agents — strategy, workflow, templates, operating guidance, and quality checks. Use when the user asks for deliverability monitoring work, implementation help, or an agent-ready deliverable.",medium,"Claude Code, Cursor, Codex, Hermes, Windsurf, OpenCode, Gemini CLI, Copilot, Zed, VS Code, Goose"
event-analytics,event-analytics,analytics,skills/analytics/event-analytics/SKILL.md,"Customer event analytics across every GTM system — Intercom, Zendesk, Salesforce, HubSpot, Segment, Amplitude, Mixpanel, PostHog, and custom event pipelines. Covers event taxonomy design, tracking implementation, event-driven workflows, and unified customer views. Use when implementing event tracking, building a customer data pipeline, or designing event-driven GTM automations. Triggers on: ""event analytics"", ""customer events"", ""event tracking"", ""product analytics"", ""Segment setup"", ""event pipeline"".",medium,"Claude Code, Cursor, Codex, Hermes, Windsurf, OpenCode, Gemini CLI, Copilot, Zed, VS Code, Goose"
growth-experimentation,growth-experimentation,analytics,skills/analytics/growth-experimentation/SKILL.md,"Build a growth experimentation system — ICE scoring, growth sprints, experiment design, statistical significance, and learning repositories. Use when building an experimentation program, running growth sprints, prioritizing tests, or establishing a data-driven growth culture. Triggers on: ""experimentation"", ""growth experiments"", ""A/B testing program"", ""ICE scoring"", ""growth sprint"", ""experiment design"", ""test velocity"", or any growth experimentation request.",medium,"Claude Code, Cursor, Codex, Hermes, Windsurf, OpenCode, Gemini CLI, Copilot, Zed, VS Code, Goose"
gtm-metrics,gtm-metrics,analytics,skills/analytics/gtm-metrics/SKILL.md,"Gtm Metrics playbook for GTM agents — strategy, workflow, templates, operating guidance, and quality checks. Use when the user asks for gtm metrics work, implementation help, or an agent-ready deliverable.",medium,"Claude Code, Cursor, Codex, Hermes, Windsurf, OpenCode, Gemini CLI, Copilot, Zed, VS Code, Goose"
gtm-system-architecture,gtm-system-architecture,analytics,skills/analytics/gtm-system-architecture/SKILL.md,"Design a complete GTM operating system — revenue model, data model, operating model, growth model, and GTM model per WbD's 6-model framework. Use when designing a GTM system from scratch, auditing an existing one, or aligning teams around a unified revenue architecture. Triggers on: ""GTM system"", ""revenue architecture"", ""operating model"", ""GTM model"", ""revenue system"", ""go-to-market design"", ""GTM audit"", or any request about designing how GTM works end-to-end.",medium,"Claude Code, Cursor, Codex, Hermes, Windsurf, OpenCode, Gemini CLI, Copilot, Zed, VS Code, Goose"
marketing-strategy,marketing-strategy,analytics,skills/analytics/marketing-strategy/SKILL.md,"Build complete B2B marketing strategies — channel mix, budget allocation, content strategy, demand generation, brand building, and measurement framework. Use when building a marketing plan, allocating marketing budget, designing multi-channel campaigns, or creating a marketing operating system. Triggers on: ""marketing strategy"", ""marketing plan"", ""demand generation"", ""brand strategy"", ""marketing budget"", ""channel strategy"", or any marketing planning request.",medium,"Claude Code, Cursor, Codex, Hermes, Windsurf, OpenCode, Gemini CLI, Copilot, Zed, VS Code, Goose"
paid-advertising,paid-advertising,analytics,skills/analytics/paid-advertising/SKILL.md,"Build and manage paid advertising campaigns across B2B platforms — LinkedIn Ads, Google Ads, Meta (Facebook/Instagram) Ads, TikTok Ads, and programmatic. Use when launching paid campaigns, allocating ad budget, selecting platforms, or optimizing paid acquisition. Triggers on: ""paid ads"", ""LinkedIn ads"", ""Google Ads"", ""Meta ads"", ""Facebook ads"", ""TikTok ads"", ""advertising"", ""paid acquisition"", ""ad budget"", ""ad campaign"", or any request about paid marketing.",medium,"Claude Code, Cursor, Codex, Hermes, Windsurf, OpenCode, Gemini CLI, Copilot, Zed, VS Code, Goose"
proactive-alerts,proactive-alerts,analytics,skills/analytics/proactive-alerts/SKILL.md,"Set up proactive GTM alert systems — CRM pipeline alerts, buying signal notifications, Slack/email routing, risk scoring. Use when building alert systems, monitoring pipeline health, detecting buying signals, or setting up automated notifications for GTM teams. Triggers on: ""alerts"", ""notifications"", ""pipeline alerts"", ""signal alerts"", ""monitor pipeline"", ""deal alerts"", ""Slack alerts"", ""pipeline monitoring"", ""proactive"", ""warning system"", or any request about automated detection and notification.",medium,"Claude Code, Cursor, Codex, Hermes, Windsurf, OpenCode, Gemini CLI, Copilot, Zed, VS Code, Goose"
tracking-plan,tracking-plan,analytics,skills/analytics/tracking-plan/SKILL.md,"Master analytics tracking plan for PLG and B2B SaaS — unified event taxonomy, pixel strategy (1P and 3P tagging), marketing attribution architecture, CDP implementation (Segment, Rudderstack), product analytics (Amplitude, Mixpanel, PostHog), CRM tracking (HubSpot, Salesforce), and analytics infrastructure design. Use when building a complete tracking plan, designing analytics architecture, implementing product analytics, or aligning marketing and product tracking. Triggers on: ""tracking plan"", ""analytics plan"", ""event tracking architecture"", ""pixel strategy"", ""analytics for PLG"", ""SaaS analytics"".",medium,"Claude Code, Cursor, Codex, Hermes, Windsurf, OpenCode, Gemini CLI, Copilot, Zed, VS Code, Goose"
ai-sdr-setup,ai-sdr-setup,automation,skills/automation/ai-sdr-setup/SKILL.md,"Deploy AI SDR agents safely and effectively — vendor selection, pilot scope, guardrails, signal routing, human handoff design, QA review, and performance metrics. Use when setting up 11x, Artisan, AiSDR, Jason AI, or any automated SDR workflow for outbound prospecting.",medium,"Claude Code, Cursor, Codex, Hermes, Windsurf, OpenCode, Gemini CLI, Copilot, Zed, VS Code, Goose"
api-enrichment,api-enrichment,automation,skills/automation/api-enrichment/SKILL.md,"Build API-first enrichment pipelines — provider selection, batching, retries, rate limits, idempotency, webhooks, cost tracking, and CRM writes. Use when integrating enrichment APIs directly into GTM systems or replacing manual data workflows with programmatic pipelines.",medium,"Claude Code, Cursor, Codex, Hermes, Windsurf, OpenCode, Gemini CLI, Copilot, Zed, VS Code, Goose"
attio-setup,attio-setup,automation,skills/automation/attio-setup/SKILL.md,"Set up Attio for B2B SaaS GTM — programmable CRM, custom objects, workflow automation, enrichment integration, and real-time collaboration. Use when configuring Attio for sales, building a programmable CRM, or migrating from HubSpot/Salesforce. Triggers on: ""Attio setup"", ""configure Attio"", ""Attio CRM"", ""Attio pipeline"", or any Attio configuration request.",medium,"Claude Code, Cursor, Codex, Hermes, Windsurf, OpenCode, Gemini CLI, Copilot, Zed, VS Code, Goose"
clay-automation,clay-automation,automation,skills/automation/clay-automation/SKILL.md,"Build production-grade Clay enrichment workflows — table architecture, waterfall configuration, Claygent AI research, Sculptor table building, CRM push with clay_status properties, credit optimization. Use when building Clay tables, configuring enrichment waterfalls, setting up Claygent, or automating GTM workflows in Clay. Triggers on: ""Clay"", ""Clay workflow"", ""Clay table"", ""Claygent"", ""Sculptor"", ""Clay enrichment"", ""Clay waterfall"", ""Clay automation"", or any request about building workflows in Clay.",medium,"Claude Code, Cursor, Codex, Hermes, Windsurf, OpenCode, Gemini CLI, Copilot, Zed, VS Code, Goose"
crm-integration,crm-integration,automation,skills/automation/crm-integration/SKILL.md,"Configure CRM systems for GTM — lifecycle stages, deal stages, field ownership, enrichment sync, dedupe, required fields, and reporting. Use when setting up HubSpot, Salesforce, Attio, or any CRM integration for sales and marketing teams.",medium,"Claude Code, Cursor, Codex, Hermes, Windsurf, OpenCode, Gemini CLI, Copilot, Zed, VS Code, Goose"
hubspot-setup,hubspot-setup,automation,skills/automation/hubspot-setup/SKILL.md,"Set up HubSpot for B2B SaaS GTM — CRM configuration, deal pipelines, lifecycle stages, marketing automation, sequences, reporting dashboards, and enrichment integration. Use when configuring HubSpot for sales, marketing, or revops. Triggers on: ""HubSpot setup"", ""configure HubSpot"", ""HubSpot CRM"", ""HubSpot pipeline"", ""HubSpot marketing"", or any HubSpot configuration request.",medium,"Claude Code, Cursor, Codex, Hermes, Windsurf, OpenCode, Gemini CLI, Copilot, Zed, VS Code, Goose"
mcp-setup,mcp-setup,automation,skills/automation/mcp-setup/SKILL.md,"Configure Model Context Protocol servers for GTM workflows — server selection, tool scope, permissions, guardrails, observability, and multi-tool orchestration. Use when connecting CRM, enrichment, sequencing, analytics, or support tools to AI agents through MCP.",medium,"Claude Code, Cursor, Codex, Hermes, Windsurf, OpenCode, Gemini CLI, Copilot, Zed, VS Code, Goose"
n8n-automation,n8n-automation,automation,skills/automation/n8n-automation/SKILL.md,"Build n8n workflows for GTM automation — triggers, webhook-to-enrichment-to-CRM pipelines, error handling, Clay export replacement for complex cases. Use when building n8n workflows or automating GTM processes beyond Clay.",medium,"Claude Code, Cursor, Codex, Hermes, Windsurf, OpenCode, Gemini CLI, Copilot, Zed, VS Code, Goose"
salesforce-setup,salesforce-setup,automation,skills/automation/salesforce-setup/SKILL.md,"Set up Salesforce for B2B SaaS GTM — object model, opportunity pipelines, lead management, reports and dashboards, automation (Flows), and enrichment integration. Use when configuring Salesforce for sales or revops. Triggers on: ""Salesforce setup"", ""configure Salesforce"", ""Salesforce CRM"", ""Salesforce pipeline"", ""Salesforce automation"", or any Salesforce configuration request.",medium,"Claude Code, Cursor, Codex, Hermes, Windsurf, OpenCode, Gemini CLI, Copilot, Zed, VS Code, Goose"
skills-lock,skills-lock,automation,skills/automation/skills-lock/SKILL.md,"skills.lock — version locking and integrity tracking for agent skills repositories. Generates a SHA256-verified lock file that tracks every skill with its version, file hash, dependencies, and last update. Use when creating skills.lock for a repo, validating skill integrity, or managing skill dependencies. Triggers on: ""skills.lock"", ""lock file"", ""skill integrity"", ""freeze skills"", ""skill dependencies"".",medium,"Claude Code, Cursor, Codex, Hermes, Windsurf, OpenCode, Gemini CLI, Copilot, Zed, VS Code, Goose"
tool-selection-stack,tool-selection-stack,automation,skills/automation/tool-selection-stack/SKILL.md,"Build the right GTM tool stack for any stage — solo founder ($100/mo), small team ($500/mo), growth team ($2K/mo), and enterprise ($10K+/mo). With cost breakdowns, tool comparisons, and stack architecture. Use when choosing GTM tools, building a tech stack, comparing platforms, or optimizing tool spend. Triggers on: ""tool stack"", ""tech stack"", ""GTM tools"", ""which tool"", ""compare tools"", ""tool budget"", ""stack for my stage"", or any tool selection request.",medium,"Claude Code, Cursor, Codex, Hermes, Windsurf, OpenCode, Gemini CLI, Copilot, Zed, VS Code, Goose"
waterfall-enrichment,waterfall-enrichment,automation,skills/automation/waterfall-enrichment/SKILL.md,"Design multi-provider enrichment waterfalls — provider ordering by cost-per-hit, 3 separate waterfalls for company, email, and phone data, always verify after finding. Use when building enrichment waterfalls or improving data coverage.",medium,"Claude Code, Cursor, Codex, Hermes, Windsurf, OpenCode, Gemini CLI, Copilot, Zed, VS Code, Goose"
aeo-strategy,aeo-strategy,content-seo,skills/content-seo/aeo-strategy/SKILL.md,"Answer Engine Optimization — optimize content for AI search engines (ChatGPT, Perplexity, Gemini, Claude). Triggers on: ""AEO"", ""answer engine optimization"", ""AI search"", ""generative engine optimization"", ""GEO"", ""optimize for AI search"".",medium,"Claude Code, Cursor, Codex, Hermes, Windsurf, OpenCode, Gemini CLI, Copilot, Zed, VS Code, Goose"
citation-harvesting,citation-harvesting,content-seo,skills/content-seo/citation-harvesting/SKILL.md,"Systematically build backlinks through citations, mentions, and digital PR — HARO, source-blogger outreach, data-driven PR. Triggers on: ""citation harvesting"", ""backlink building"", ""HARO"", ""digital PR"", ""link building"".",medium,"Claude Code, Cursor, Codex, Hermes, Windsurf, OpenCode, Gemini CLI, Copilot, Zed, VS Code, Goose"
faq-seo,faq-seo,content-seo,skills/content-seo/faq-seo/SKILL.md,"Build FAQ pages that capture featured snippets and People Also Ask traffic — question-driven content strategy. Triggers on: ""FAQ SEO"", ""featured snippet"", ""People Also Ask"", ""question SEO"", ""answer content"".",medium,"Claude Code, Cursor, Codex, Hermes, Windsurf, OpenCode, Gemini CLI, Copilot, Zed, VS Code, Goose"
pillar-pages,pillar-pages,content-seo,skills/content-seo/pillar-pages/SKILL.md,"Design and build pillar pages with topic clusters — comprehensive hub pages that rank for high-intent keywords. Triggers on: ""pillar page"", ""topic cluster"", ""hub page"", ""cornerstone content"", ""SEO pillar"".",medium,"Claude Code, Cursor, Codex, Hermes, Windsurf, OpenCode, Gemini CLI, Copilot, Zed, VS Code, Goose"
pseo-strategy,pseo-strategy,content-seo,skills/content-seo/pseo-strategy/SKILL.md,"Programmatic SEO — build scalable, template-driven content pages for long-tail keywords. Triggers on: ""pSEO"", ""programmatic SEO"", ""scalable SEO"", ""template SEO"", ""mass content generation"".",medium,"Claude Code, Cursor, Codex, Hermes, Windsurf, OpenCode, Gemini CLI, Copilot, Zed, VS Code, Goose"
seo-strategy,seo-strategy,content-seo,skills/content-seo/seo-strategy/SKILL.md,"B2B SEO strategy — keyword research, content architecture, technical SEO, link building, measurement. Triggers on: ""SEO strategy"", ""search engine optimization"", ""B2B SEO"", ""keyword research"", ""SEO plan"".",medium,"Claude Code, Cursor, Codex, Hermes, Windsurf, OpenCode, Gemini CLI, Copilot, Zed, VS Code, Goose"
ad-creative-strategy,ad-creative-strategy,creative,skills/creative/ad-creative-strategy/SKILL.md,"Develop ad creative strategy for B2B campaigns — creative formats per platform, testing methodology, creative fatigue management, UGC/AI-generated creative, and performance measurement. Use when creating ad creative, managing creative production, testing ad variants, or scaling creative output. Triggers on: ""ad creative"", ""creative strategy"", ""ad copy"", ""ad design"", ""creative testing"", ""UGC ads"", ""ad fatigue"", or any ad creative request.",medium,"Claude Code, Cursor, Codex, Hermes, Windsurf, OpenCode, Gemini CLI, Copilot, Zed, VS Code, Goose"
ai-content-creation,ai-content-creation,creative,skills/creative/ai-content-creation/SKILL.md,"AI-powered content creation workflows — step-by-step processes for using Claude, ChatGPT, Jasper, Copy.ai, Writesonic, and Perplexity to generate, edit, and optimize blog posts, social media content, email sequences, ad copy, landing page copy, and SEO content. Use when scaling content production, building an AI-assisted content pipeline, or teaching non-writers to produce high-quality content with AI. Triggers on: ""AI content"", ""ChatGPT for blog"", ""AI copywriting"", ""scale content with AI"".",medium,"Claude Code, Cursor, Codex, Hermes, Windsurf, OpenCode, Gemini CLI, Copilot, Zed, VS Code, Goose"
ai-video-creation,ai-video-creation,creative,skills/creative/ai-video-creation/SKILL.md,"AI-powered video creation for marketing — step-by-step workflows for HeyGen (AI spokespersons), Synthesia (AI avatars), Runway (generative video), Captions (AI editing), Opus Clip (AI clipping), ElevenLabs (AI voiceover), and Descript (AI editing). Use when creating demo videos, personalized outreach videos, social video content, ads, or scaling video production without a video team. Triggers on: ""AI video"", ""HeyGen"", ""Synthesia"", ""Runway AI"", ""AI spokesperson video"", ""AI ads"".",medium,"Claude Code, Cursor, Codex, Hermes, Windsurf, OpenCode, Gemini CLI, Copilot, Zed, VS Code, Goose"
content-distribution,content-distribution,creative,skills/creative/content-distribution/SKILL.md,"Distribute content across channels for maximum reach — multi-platform repurposing, syndication, paid amplification, email distribution, and partner promotion. Use when getting content in front of an audience, repurposing content, or building a distribution engine. Triggers on: ""content distribution"", ""promote content"", ""repurpose content"", ""syndication"", ""amplify content"", ""get more eyes on"", or any content amplification request.",medium,"Claude Code, Cursor, Codex, Hermes, Windsurf, OpenCode, Gemini CLI, Copilot, Zed, VS Code, Goose"
copywriting,copywriting,creative,skills/creative/copywriting/SKILL.md,"Write marketing copy that converts — landing pages, ads, emails, social, headlines, and brand voice. Use when writing any marketing or sales copy beyond cold email. Triggers on: ""copywriting"", ""write copy"", ""headline"", ""landing page copy"", ""ad copy"", ""marketing copy"", ""brand voice"", ""tagline"", or any request to write persuasive marketing text.",medium,"Claude Code, Cursor, Codex, Hermes, Windsurf, OpenCode, Gemini CLI, Copilot, Zed, VS Code, Goose"
graphic-design-gtm,graphic-design-gtm,creative,skills/creative/graphic-design-gtm/SKILL.md,"Create GTM visual assets — social graphics, ad creatives, pitch deck design, one-pager layouts, email images, data visualization, and brand-consistent templates. Use when creating visual content for GTM, designing social media graphics, building ad creatives, or establishing visual identity for campaigns. Triggers on: ""graphic design"", ""social graphics"", ""ad creative"", ""visual design"", ""banner design"", ""social image"", ""presentation design"", ""brand visuals"", ""data visualization"", ""infographic"", or any visual asset creation request.",medium,"Claude Code, Cursor, Codex, Hermes, Windsurf, OpenCode, Gemini CLI, Copilot, Zed, VS Code, Goose"
growth-hacking-tactics,growth-hacking-tactics,creative,skills/creative/growth-hacking-tactics/SKILL.md,"Tactical growth hacking playbook — rapid experimentation, growth loops, viral mechanics, referral flywheels, PLG hacks, content-led growth loops, community-driven growth, and low-cost acquisition tactics for B2B SaaS. Based on Sean Ellis, Brian Balfour, Andrew Chen, and Reforge frameworks. Use when designing growth experiments, building growth loops, or finding low-cost acquisition channels. Triggers on: ""growth hacking"", ""growth loops"", ""viral mechanics"", ""growth experiments"", ""referral flywheel"".",medium,"Claude Code, Cursor, Codex, Hermes, Windsurf, OpenCode, Gemini CLI, Copilot, Zed, VS Code, Goose"
