slug,name,category,path,description,priority,compatibility
leadmagic-waterfall,leadmagic-waterfall,leadmagic,skills/leadmagic/leadmagic-waterfall/SKILL.md,"Build Clay enrichment waterfalls with LeadMagic as the primary provider — 95%+ email coverage, multi-provider chaining, verification integration, catch-all resolution. Use when setting up LeadMagic in Clay workflows, building enrichment waterfalls, or optimizing data coverage for outbound prospecting. Triggers on: ""LeadMagic waterfall"", ""LeadMagic in Clay"", ""waterfall enrichment LeadMagic"", ""Clay LeadMagic setup"", or any request about LeadMagic-based enrichment pipelines.",medium,"Claude Code, Cursor, Codex, Hermes, Windsurf, OpenCode, Gemini CLI, Copilot, Zed, VS Code, Goose"
churn-prediction,churn-prediction,lifecycle,skills/lifecycle/churn-prediction/SKILL.md,"Build churn prediction models — leading indicators, risk scoring, early warning systems, intervention playbooks. Triggers on: ""churn prediction"", ""predict churn"", ""churn model"", ""early warning"", ""risk scoring"".",medium,"Claude Code, Cursor, Codex, Hermes, Windsurf, OpenCode, Gemini CLI, Copilot, Zed, VS Code, Goose"
lifecycle-drips,lifecycle-drips,lifecycle,skills/lifecycle/lifecycle-drips/SKILL.md,"Design lifecycle drip campaigns — post-purchase, renewal, expansion, milestone-based automated email programs. Triggers on: ""lifecycle drips"", ""automated campaigns"", ""lifecycle emails"", ""drip sequences"", ""triggered emails"".",medium,"Claude Code, Cursor, Codex, Hermes, Windsurf, OpenCode, Gemini CLI, Copilot, Zed, VS Code, Goose"
mql-nurture,mql-nurture,lifecycle,skills/lifecycle/mql-nurture/SKILL.md,"Build MQL nurture programs — lead scoring, nurture tracks, email drip sequences, MQL→SQL conversion. Triggers on: ""MQL nurture"", ""lead nurture"", ""nurture tracks"", ""MQL to SQL"", ""lead scoring"".",medium,"Claude Code, Cursor, Codex, Hermes, Windsurf, OpenCode, Gemini CLI, Copilot, Zed, VS Code, Goose"
onboarding-sequences,onboarding-sequences,lifecycle,skills/lifecycle/onboarding-sequences/SKILL.md,"Design customer onboarding sequences — time-to-first-value, activation milestones, guided setup, onboarding emails. Triggers on: ""onboarding sequence"", ""customer onboarding"", ""time to value"", ""activation flow"", ""new customer setup"".",medium,"Claude Code, Cursor, Codex, Hermes, Windsurf, OpenCode, Gemini CLI, Copilot, Zed, VS Code, Goose"
re-engagement,re-engagement,lifecycle,skills/lifecycle/re-engagement/SKILL.md,"Design re-engagement campaigns for dormant leads and inactive customers — win-back sequences, reactivation offers, sunset policies. Triggers on: ""re-engagement"", ""win-back"", ""reactivation"", ""dormant leads"", ""inactive customers"".",medium,"Claude Code, Cursor, Codex, Hermes, Windsurf, OpenCode, Gemini CLI, Copilot, Zed, VS Code, Goose"
sales-coaching,sales-coaching,management-leadership,skills/management-leadership/sales-coaching/SKILL.md,"Coach sales reps for consistent performance — REKS framework, deal reviews, call coaching, pipeline inspection, and 1:1 cadences. Use when setting up sales coaching, training managers, or improving rep performance. Triggers on: ""sales coaching"", ""coach reps"", ""REKS"", ""deal review"", ""call coaching"", ""manager coaching"", ""1:1"", or any request about developing sellers.",medium,"Claude Code, Cursor, Codex, Hermes, Windsurf, OpenCode, Gemini CLI, Copilot, Zed, VS Code, Goose"
team-management,team-management,management-leadership,skills/management-leadership/team-management/SKILL.md,"Team management for startup leaders — 1:1s, performance reviews, goal setting (OKRs), delegation, feedback culture, remote team management, team rituals, and scaling from IC to manager. Use when building team processes, managing first direct reports, or scaling management as the company grows. Triggers on: ""team management"", ""1:1 template"", ""performance review"", ""OKR setting"", ""delegation"", ""managing remote team"".",medium,"Claude Code, Cursor, Codex, Hermes, Windsurf, OpenCode, Gemini CLI, Copilot, Zed, VS Code, Goose"
cold-calling,cold-calling,outbound,skills/outbound/cold-calling/SKILL.md,"Build and execute B2B cold calling programs — phone intent scoring, precision dialing, the Buckets methodology, multi-touch cadences, and conversation-to-meeting conversion. Use when setting up cold calling, training SDRs, improving connect rates, or building a phone outreach motion. Triggers on: ""cold calling"", ""cold call"", ""phone outreach"", ""SDR calling"", ""connect rate"", ""dialer"", ""phone prospecting"", ""calling strategy"", ""cold call script"", ""phone intent"", ""precision dialing"", or any request about outbound phone prospecting.",medium,"Claude Code, Cursor, Codex, Hermes, Windsurf, OpenCode, Gemini CLI, Copilot, Zed, VS Code, Goose"
cold-email-copywriting,cold-email-copywriting,outbound,skills/outbound/cold-email-copywriting/SKILL.md,"Writes high-converting cold email copy using the 3-line framework, proven subject line patterns, and persona-specific variants. Use when the user asks to write, improve, or critique cold email copy, craft subject lines, personalize outreach at any tier, or apply copywriting frameworks like PAS, BAB, AIDA, or SPARK. Activates on phrases like ""write a cold email,"" ""draft outreach,"" ""improve my cold email copy,"" ""subject line help,"" or ""personalize this email.",medium,"Claude Code, Cursor, Codex, Hermes, Windsurf, OpenCode, Gemini CLI, Copilot, Zed, VS Code, Goose"
cold-email-strategy,cold-email-strategy,outbound,skills/outbound/cold-email-strategy/SKILL.md,"Designs high-performing cold email sequence architecture with proper cadence timing, channel mixing, and trigger-based logic. Use when the user asks to build, audit, or optimize a cold outreach sequence, design a multi-touch cadence, plan sending limits, or structure outbound campaigns. Activates on phrases like ""build me a sequence,"" ""design a cadence,"" ""cold email outreach plan,"" ""outbound strategy,"" ""multi-touch sequence,"" or ""trigger-based outreach.",medium,"Claude Code, Cursor, Codex, Hermes, Windsurf, OpenCode, Gemini CLI, Copilot, Zed, VS Code, Goose"
domain-infrastructure,domain-infrastructure,outbound,skills/outbound/domain-infrastructure/SKILL.md,"Designs and provisions the domain and mailbox infrastructure for cold email outreach: secondary domains, mailbox setup (Google Workspace, M365, Zoho), DNS authentication records, inbox rotation, and primary domain isolation. Use when the user asks to set up sending domains, provision mailboxes, configure DNS for cold email, or plan domain rotation for outbound. Activates on phrases like ""set up sending domains,"" ""buy secondary domains,"" ""provision mailboxes,"" ""configure email for cold outreach,"" or ""domain rotation plan.",medium,"Claude Code, Cursor, Codex, Hermes, Windsurf, OpenCode, Gemini CLI, Copilot, Zed, VS Code, Goose"
email-deliverability,email-deliverability,outbound,skills/outbound/email-deliverability/SKILL.md,"Sets up and monitors email deliverability infrastructure including SPF, DKIM, DMARC configuration, warmup strategy, reputation monitoring, bounce and complaint handling, and ongoing deliverability health. Use when the user asks about email deliverability, SPF/DKIM/DMARC setup, warmup schedules, bounce rate troubleshooting, spam placement issues, or domain reputation. Activates on phrases like ""improve deliverability,"" ""emails going to spam,"" ""warmup my domain,"" ""DNS setup for cold email,"" ""bounce rate,"" or ""DMARC setup.",medium,"Claude Code, Cursor, Codex, Hermes, Windsurf, OpenCode, Gemini CLI, Copilot, Zed, VS Code, Goose"
inbox-setup,inbox-setup,outbound,skills/outbound/inbox-setup/SKILL.md,"Set up cold email inbox infrastructure from scratch — Google Workspace, Microsoft 365, and Azure/Entra inbox provisioning, DNS authentication, domain buying, warmup, and cost optimization. Use when setting up sending infrastructure, buying domains, provisioning mailboxes, or scaling cold email sending capacity. Triggers on: ""inbox setup"", ""email infrastructure"", ""buy domains"", ""Google Workspace inbox"", ""Microsoft inbox"", ""Azure inbox"", ""cold email setup"", ""sending infrastructure"", ""provision inboxes"", ""DNS setup"", or any request about building cold email infra.",medium,"Claude Code, Cursor, Codex, Hermes, Windsurf, OpenCode, Gemini CLI, Copilot, Zed, VS Code, Goose"
multi-channel-outreach,multi-channel-outreach,outbound,skills/outbound/multi-channel-outreach/SKILL.md,"Design and execute multi-channel outbound sequences across email, LinkedIn, cold calls, and SMS. Use when the user wants to coordinate outreach across channels, build multi-touch sequences, add LinkedIn to their outbound, or create a channel mix strategy. Triggers on: ""multi-channel"", ""LinkedIn outreach"", ""cold calling"", ""SMS outreach"", ""channel mix"", ""add LinkedIn to sequence"", ""cross-channel"", ""multi-touch"", or any request to coordinate multiple outreach channels.",medium,"Claude Code, Cursor, Codex, Hermes, Windsurf, OpenCode, Gemini CLI, Copilot, Zed, VS Code, Goose"
reply-handling,reply-handling,outbound,skills/outbound/reply-handling/SKILL.md,"Classifies and automates responses to cold email replies using an 8-category taxonomy, auto-reply playbooks, and human escalation rules. Use when the user asks to set up reply handling, needs reply classification logic, wants auto-responder templates for common replies, or needs escalation rules for human handoff. Activates on phrases like ""handle cold email replies,"" ""auto reply to outbound,"" ""reply classification,"" ""meeting booked response,"" ""not interested reply,"" or ""escalate to AE.",medium,"Claude Code, Cursor, Codex, Hermes, Windsurf, OpenCode, Gemini CLI, Copilot, Zed, VS Code, Goose"
sending-platforms,sending-platforms,outbound,skills/outbound/sending-platforms/SKILL.md,"Compares, selects, and configures cold email sending platforms: Smartlead, Instantly, Salesforge, Apollo, and others. Use when the user asks which sending platform to use, needs to compare features or pricing, wants to migrate between platforms, or needs platform-specific setup guidance. Activates on phrases like ""which email platform,"" ""Smartlead vs Instantly,"" ""best sending tool,"" ""Salesforge setup,"" ""Apollo sequences,"" or ""migrate sending platform.",medium,"Claude Code, Cursor, Codex, Hermes, Windsurf, OpenCode, Gemini CLI, Copilot, Zed, VS Code, Goose"
co-marketing,co-marketing,partnerships,skills/partnerships/co-marketing/SKILL.md,"Execute co-marketing campaigns with partners — joint webinars, co-branded content, shared audiences, mutual promotion. Triggers on: ""co-marketing"", ""joint marketing"", ""partner marketing"", ""co-branded campaign"".",medium,"Claude Code, Cursor, Codex, Hermes, Windsurf, OpenCode, Gemini CLI, Copilot, Zed, VS Code, Goose"
integration-partnerships,integration-partnerships,partnerships,skills/partnerships/integration-partnerships/SKILL.md,"Build and go-to-market with technology integration partnerships — API/integration GTM, marketplace listing, co-selling. Triggers on: ""integration partnership"", ""tech partnership"", ""API partnership"", ""marketplace listing"".",medium,"Claude Code, Cursor, Codex, Hermes, Windsurf, OpenCode, Gemini CLI, Copilot, Zed, VS Code, Goose"
partnership-strategy,partnership-strategy,partnerships,skills/partnerships/partnership-strategy/SKILL.md,"Build a partnership program — partner types, recruitment, enablement, co-marketing, revenue share models. Triggers on: ""partnership strategy"", ""partner program"", ""channel partnerships"", ""build partnerships"".",medium,"Claude Code, Cursor, Codex, Hermes, Windsurf, OpenCode, Gemini CLI, Copilot, Zed, VS Code, Goose"
freemium-optimization,freemium-optimization,product-led-growth,skills/product-led-growth/freemium-optimization/SKILL.md,"Freemium and free trial conversion optimization — activation flow design, paywall placement, upgrade triggers, PQL scoring, time-to-value reduction, and freemium monetization models. Use when optimizing freemium conversion, designing free-to-paid upgrade paths, or balancing free vs premium features. Triggers on: ""freemium optimization"", ""free trial conversion"", ""PQL scoring"", ""activation flow"", ""paywall design"", ""freemium to paid"".",medium,"Claude Code, Cursor, Codex, Hermes, Windsurf, OpenCode, Gemini CLI, Copilot, Zed, VS Code, Goose"
plg-strategy,plg-strategy,product-led-growth,skills/product-led-growth/plg-strategy/SKILL.md,"Design product-led growth motions — freemium vs free trial, PQL scoring, self-serve conversion, PLG sales hybrid, and product-led marketing. Use when building a PLG motion, transitioning to self-serve, or optimizing product-led acquisition. Triggers on: ""product-led growth"", ""PLG"", ""freemium"", ""free trial"", ""self-serve"", ""PQL"", ""product qualified lead"", ""product-led sales"", or any request about product-driven growth.",medium,"Claude Code, Cursor, Codex, Hermes, Windsurf, OpenCode, Gemini CLI, Copilot, Zed, VS Code, Goose"
contact-verification,contact-verification,prospecting,skills/prospecting/contact-verification/SKILL.md,"Verify email addresses before they enter outbound sequences to prevent bounces and protect sender reputation. Use when the user wants to validate emails, check deliverability, verify contact data, prevent bounces, clean a list, or ensure their outreach list is safe to send. Triggers on: \""verify emails\"", \""validate this list\"", \""check if these emails are real\"", \""email verification\"", \""bounce prevention\"", \""clean my list\"", \""are these safe to send\"", or any request to confirm email deliverability before outreach.",medium,"Claude Code, Cursor, Codex, Hermes, Windsurf, OpenCode, Gemini CLI, Copilot, Zed, VS Code, Goose"
data-enrichment-strategy,data-enrichment-strategy,prospecting,skills/prospecting/data-enrichment-strategy/SKILL.md,"Design an end-to-end B2B data enrichment architecture — provider selection, waterfall design, cost modeling, and CRM hygiene. Use when the user wants to evaluate enrichment providers, build an enrichment stack, compare data vendors, or design their data architecture. Triggers on: ""enrichment strategy"", ""which data provider"", ""compare Apollo vs ZoomInfo"", ""build enrichment architecture"", ""data stack"", ""enrichment vendors"", or any request about choosing or combining B2B data sources.",medium,"Claude Code, Cursor, Codex, Hermes, Windsurf, OpenCode, Gemini CLI, Copilot, Zed, VS Code, Goose"
email-finding,email-finding,prospecting,skills/prospecting/email-finding/SKILL.md,"Find verified work email addresses for B2B contacts using multi-provider waterfall discovery. Use when the user wants to find emails, look up contact information, discover email patterns, enrich a list with email addresses, find decision-maker emails, or get verified contact data for outreach. Triggers on: \""find email\"", \""get their email\"", \""email discovery\"", \""look up email\"", \""find contact info\"", \""email enrichment\"", \""what's their email\"", or any request to locate professional email addresses for prospects.",medium,"Claude Code, Cursor, Codex, Hermes, Windsurf, OpenCode, Gemini CLI, Copilot, Zed, VS Code, Goose"
lead-enrichment,lead-enrichment,prospecting,skills/prospecting/lead-enrichment/SKILL.md,"Lead Enrichment playbook for GTM agents — strategy, workflow, templates, operating guidance, and quality checks. Use when the user asks for lead enrichment work, implementation help, or an agent-ready deliverable.",medium,"Claude Code, Cursor, Codex, Hermes, Windsurf, OpenCode, Gemini CLI, Copilot, Zed, VS Code, Goose"
lead-finding,lead-finding,prospecting,skills/prospecting/lead-finding/SKILL.md,"Lead Finding playbook for GTM agents — strategy, workflow, templates, operating guidance, and quality checks. Use when the user asks for lead finding work, implementation help, or an agent-ready deliverable.",medium,"Claude Code, Cursor, Codex, Hermes, Windsurf, OpenCode, Gemini CLI, Copilot, Zed, VS Code, Goose"
list-building,list-building,prospecting,skills/prospecting/list-building/SKILL.md,"Build qualified B2B prospect lists using Clay, LinkedIn Sales Navigator, and multi-source discovery. Use when the user wants to build a prospect list, create a target account list, find companies matching an ICP, scrape lead sources, or compile a list for outbound. Triggers on: ""build a list"", ""prospect list"", ""target accounts"", ""find companies"", ""scrape leads"", ""list building"", ""who should we reach out to"", or any request to compile prospect data.",medium,"Claude Code, Cursor, Codex, Hermes, Windsurf, OpenCode, Gemini CLI, Copilot, Zed, VS Code, Goose"
signal-scoring,signal-scoring,prospecting,skills/prospecting/signal-scoring/SKILL.md,"Score and prioritize prospects using buying signals — hiring, funding, tech stack changes, executive moves, and intent data. Use when the user wants to score leads, prioritize outreach, detect buying intent, rank prospects, or find the hottest accounts. Triggers on: ""score leads"", ""prioritize"", ""signals"", ""buying intent"", ""trigger events"", ""who should we contact first"", ""lead scoring"", ""signal detection"", ""intent data"", or any request to rank prospects by readiness-to-buy.",medium,"Claude Code, Cursor, Codex, Hermes, Windsurf, OpenCode, Gemini CLI, Copilot, Zed, VS Code, Goose"
earnings-signal-play,earnings-signal-play,sales-plays,skills/sales-plays/earnings-signal-play/SKILL.md,"Outbound play triggered by public company earnings calls — strategic priority mining, new-initiative alignment, urgency creation. Triggers on: ""earnings signal"", ""earnings play"", ""public company outbound"", ""10-K outreach"".",medium,"Claude Code, Cursor, Codex, Hermes, Windsurf, OpenCode, Gemini CLI, Copilot, Zed, VS Code, Goose"
funding-signal-play,funding-signal-play,sales-plays,skills/sales-plays/funding-signal-play/SKILL.md,"Trigger-based outbound play when a target account raises funding — urgency messaging, use-of-funds alignment, 7-14 day window. Triggers on: ""funding signal"", ""funding play"", ""raised money outreach"", ""funding announcement outbound"".",medium,"Claude Code, Cursor, Codex, Hermes, Windsurf, OpenCode, Gemini CLI, Copilot, Zed, VS Code, Goose"
hiring-signal-play,hiring-signal-play,sales-plays,skills/sales-plays/hiring-signal-play/SKILL.md,"Outbound play triggered by specific hiring signals — VP Sales, RevOps, SDR manager, CRO postings signal budget and strategy shift. Triggers on: ""hiring signal"", ""job post outbound"", ""hiring trigger"", ""new role outreach"".",medium,"Claude Code, Cursor, Codex, Hermes, Windsurf, OpenCode, Gemini CLI, Copilot, Zed, VS Code, Goose"
job-change-play,job-change-play,sales-plays,skills/sales-plays/job-change-play/SKILL.md,"Outbound play triggered by contact job changes — champion tracking, new-role outreach, ""new broom"" timing. Triggers on: ""job change"", ""new role"", ""champion moved"", ""job change outreach"", ""contact changed jobs"".",medium,"Claude Code, Cursor, Codex, Hermes, Windsurf, OpenCode, Gemini CLI, Copilot, Zed, VS Code, Goose"
product-launch-play,product-launch-play,sales-plays,skills/sales-plays/product-launch-play/SKILL.md,"Outbound play triggered by competitor product launches or target account product launches — timing-based urgency, competitive positioning. Triggers on: ""product launch play"", ""competitor launch response"", ""launch-based outbound"".",medium,"Claude Code, Cursor, Codex, Hermes, Windsurf, OpenCode, Gemini CLI, Copilot, Zed, VS Code, Goose"
deal-desk,deal-desk,sales-revops,skills/sales-revops/deal-desk/SKILL.md,"Structure deals, pricing, and proposals — pricing model selection, discount guidance, business case construction, and negotiation strategy. Use when structuring a deal, building a pricing proposal, negotiating, or creating a business case. Triggers on: ""deal desk"", ""pricing"", ""proposal"", ""negotiation"", ""discount"", ""business case"", ""ROI case"", ""deal structure"", or any pricing/financial request in a sales context.",medium,"Claude Code, Cursor, Codex, Hermes, Windsurf, OpenCode, Gemini CLI, Copilot, Zed, VS Code, Goose"
demo-scripts,demo-scripts,sales-revops,skills/sales-revops/demo-scripts/SKILL.md,"Write compelling demo scripts — first demo, technical deep-dive, and executive overview. Scene-by-scene with timing, talk tracks, and interaction points. Use when building demo scripts, preparing for a demo, or structuring product demonstrations. Triggers on: ""demo script"", ""product demo"", ""demo flow"", ""how to demo"", ""demo structure"", ""demo talk track"", or any demo-related request.",medium,"Claude Code, Cursor, Codex, Hermes, Windsurf, OpenCode, Gemini CLI, Copilot, Zed, VS Code, Goose"
meeting-prep,meeting-prep,sales-revops,skills/sales-revops/meeting-prep/SKILL.md,"Prepare comprehensive meeting briefs — account research, attendee profiles, SPIN/MEDDIC discovery questions, competitive context. Use when preparing for a sales call, discovery meeting, demo, or any prospect interaction. Triggers on: ""meeting prep"", ""call prep"", ""discovery prep"", ""brief me on"", ""prepare for meeting"", ""research this account"", ""pre-call research"", ""what should I ask"", ""discovery questions"", or any request about getting ready for a prospect call.",medium,"Claude Code, Cursor, Codex, Hermes, Windsurf, OpenCode, Gemini CLI, Copilot, Zed, VS Code, Goose"
objection-handling,objection-handling,sales-revops,skills/sales-revops/objection-handling/SKILL.md,"Build comprehensive objection handling playbooks — 6-category taxonomy, AER framework, battlecards per competitor, pre-handling in outreach. Use when creating objection responses, building an objection playbook, or preparing reps for tough conversations. Triggers on: ""objection handling"", ""objection"", ""how to respond to"", ""they said"", ""pushback"", ""handle objection"", ""what to say when"", ""objection playbook"", or any request about responding to prospect pushback.",medium,"Claude Code, Cursor, Codex, Hermes, Windsurf, OpenCode, Gemini CLI, Copilot, Zed, VS Code, Goose"
pipeline-management,pipeline-management,sales-revops,skills/sales-revops/pipeline-management/SKILL.md,"Manage B2B sales pipelines with structured deal stages, forecasting, CRM hygiene, and deal inspection cadences. Use when setting up pipeline processes, improving forecast accuracy, or designing deal stages. Triggers on: ""pipeline management"", ""forecasting"", ""deal inspection"", ""CRM hygiene"", ""pipeline review"", ""deal stages"", ""sales process"", or any pipeline-related request.",medium,"Claude Code, Cursor, Codex, Hermes, Windsurf, OpenCode, Gemini CLI, Copilot, Zed, VS Code, Goose"
sales-enablement,sales-enablement,sales-revops,skills/sales-revops/sales-enablement/SKILL.md,"Create sales collateral that reps actually use — pitch decks, one-pagers, battlecards, objection docs, demo scripts, talk tracks, and playbooks. Use when the user wants to create sales materials, build a pitch deck, write a one-pager, create objection handling docs, or arm their sales team. Triggers on: ""sales enablement"", ""pitch deck"", ""one-pager"", ""sales collateral"", ""battlecard"", ""sales deck"", ""objection doc"", ""sales playbook"", ""demo script"", ""leave-behind"", ""talk track"", or any request about creating materials for sales teams.",medium,"Claude Code, Cursor, Codex, Hermes, Windsurf, OpenCode, Gemini CLI, Copilot, Zed, VS Code, Goose"
transparency-selling,transparency-selling,sales-revops,skills/sales-revops/transparency-selling/SKILL.md,"Execute Todd Caponi's Transparency Sale methodology — lead with flaws, build the ""Our Flaws"" slide, negotiate with radical honesty, use the 4.2-4.5 effect in positioning. Use when building pitch decks, handling objections, negotiating, or designing sales process. Triggers on: ""transparency sale"", ""lead with flaws"", ""Todd Caponi"", ""radical honesty"", ""transparent selling"", ""our flaws slide"".",medium,"Claude Code, Cursor, Codex, Hermes, Windsurf, OpenCode, Gemini CLI, Copilot, Zed, VS Code, Goose"
hubspot-sequences,hubspot-sequences,sequencing-tools,skills/sequencing-tools/hubspot-sequences/SKILL.md,"Design and optimize HubSpot sequences — enrollment triggers, multi-channel steps, task creation, analytics, A/B testing. Triggers on: ""HubSpot sequences"", ""HubSpot automation"", ""HubSpot cadence"", ""sales hub sequences"".",medium,"Claude Code, Cursor, Codex, Hermes, Windsurf, OpenCode, Gemini CLI, Copilot, Zed, VS Code, Goose"
instantly-sequences,instantly-sequences,sequencing-tools,skills/sequencing-tools/instantly-sequences/SKILL.md,"Set up Instantly — unlimited accounts, warmup pool, campaign optimization, unified inbox. Triggers on: ""Instantly"", ""Instantly setup"", ""Instantly campaigns"", ""Instantly warmup"".",medium,"Claude Code, Cursor, Codex, Hermes, Windsurf, OpenCode, Gemini CLI, Copilot, Zed, VS Code, Goose"
lemlist-setup,lemlist-setup,sequencing-tools,skills/sequencing-tools/lemlist-setup/SKILL.md,"Set up and optimize Lemlist — personalized images/videos, multi-channel sequences, warm-up, deliverability. Triggers on: ""Lemlist"", ""Lemlist setup"", ""Lemlist campaigns"", ""personalized cold email"".",medium,"Claude Code, Cursor, Codex, Hermes, Windsurf, OpenCode, Gemini CLI, Copilot, Zed, VS Code, Goose"
outreach-sequences,outreach-sequences,sequencing-tools,skills/sequencing-tools/outreach-sequences/SKILL.md,"Design and manage Outreach sequences — multi-channel cadences, triggers, analytics, team workflows. Triggers on: ""Outreach sequences"", ""Outreach cadence"", ""Outreach setup"", ""Outreach automation"".",medium,"Claude Code, Cursor, Codex, Hermes, Windsurf, OpenCode, Gemini CLI, Copilot, Zed, VS Code, Goose"
