slug,name,category,path,description,priority,compatibility
social-media-strategy,social-media-strategy,creative,skills/creative/social-media-strategy/SKILL.md,"Build and execute social media strategy for B2B — LinkedIn, X/Twitter, posting cadence, engagement tactics, content formats, sizing guides, and platform-specific best practices. Use when building social presence, planning content, or optimizing engagement. Triggers on: ""social media"", ""LinkedIn strategy"", ""Twitter strategy"", ""X strategy"", ""posting guide"", ""social content"", ""engagement"", ""content calendar"", ""image sizes"", ""social graphics"", or any social media planning request.",medium,"Claude Code, Cursor, Codex, Hermes, Windsurf, OpenCode, Gemini CLI, Copilot, Zed, VS Code, Goose"
v0-lander,v0-lander,creative,skills/creative/v0-lander/SKILL.md,"Step-by-step guide to building GTM landing pages with v0 by Vercel — the AI generative UI platform. Covers prompt engineering for v0, iterating on generated UI, exporting to Next.js, deploying on Vercel, and connecting forms/analytics. Use when building a landing page, pricing page, waitlist page, event page, or marketing microsite with v0. Triggers on: ""v0"", ""v0 by Vercel"", ""v0 landing page"", ""build landing page with AI"", ""v0 pricing page"", ""v0 tutorial"".",medium,"Claude Code, Cursor, Codex, Hermes, Windsurf, OpenCode, Gemini CLI, Copilot, Zed, VS Code, Goose"
vibe-coding,vibe-coding,creative,skills/creative/vibe-coding/SKILL.md,"AI-powered development for GTM — vibe coding workflows using v0, Cursor, Claude Code, Lovable, Bolt.new, Replit Agent, and Tempo Labs for rapidly building landing pages, marketing sites, tools, dashboards, and prototypes. Based on Andrej Karpathy's ""vibe coding"" philosophy. Use when building GTM assets with AI, shipping marketing sites fast, or teaching non-technical team members to build with AI. Triggers on: ""vibe coding"", ""AI dev tools"", ""build with AI"", ""v0 by Vercel"", ""Lovable"", ""Bolt"", ""Cursor AI"".",medium,"Claude Code, Cursor, Codex, Hermes, Windsurf, OpenCode, Gemini CLI, Copilot, Zed, VS Code, Goose"
vibe-marketing,vibe-marketing,creative,skills/creative/vibe-marketing/SKILL.md,"AI-powered marketing at scale — vibe marketing workflows for rapid content generation, creative iteration, campaign launches, and growth experiments using ChatGPT, Claude, Midjourney, Runway, HeyGen, ElevenLabs, and AI video tools. Based on the ""vibe coding"" philosophy applied to marketing. Use when scaling content production with AI, launching campaigns fast, generating creative variants, or building a marketing engine that runs on prompts. Triggers on: ""vibe marketing"", ""AI marketing"", ""AI content"", ""scale content with AI"", ""AI campaign generation"".",medium,"Claude Code, Cursor, Codex, Hermes, Windsurf, OpenCode, Gemini CLI, Copilot, Zed, VS Code, Goose"
cs-analytics-dashboards,cs-analytics-dashboards,customer-success,skills/customer-success/cs-analytics-dashboards/SKILL.md,"Build customer success analytics dashboards — NPS, CSAT, CES, customer health scores, churn prediction models, expansion propensity, support volume trends, and CS team performance. Use when designing CS metrics, building health score models, setting up CS dashboards, analyzing churn patterns, or measuring CS team effectiveness. Triggers on: ""CS analytics"", ""health score"", ""churn prediction"", ""NPS dashboard"", ""CS metrics"".",medium,"Claude Code, Cursor, Codex, Hermes, Windsurf, OpenCode, Gemini CLI, Copilot, Zed, VS Code, Goose"
cs-playbooks,cs-playbooks,customer-success,skills/customer-success/cs-playbooks/SKILL.md,"Build customer success playbooks — onboarding, health scoring, CSQLs, expansion plays, QBRs, and churn intervention. Use when building a CS function, designing customer journeys, or creating playbooks for retention and expansion. Triggers on: ""customer success"", ""CS playbook"", ""onboarding"", ""health score"", ""CSQL"", ""expansion play"", ""customer retention"", ""QBR"", or any request about post-sale customer engagement.",medium,"Claude Code, Cursor, Codex, Hermes, Windsurf, OpenCode, Gemini CLI, Copilot, Zed, VS Code, Goose"
customer-onboarding,customer-onboarding,customer-success,skills/customer-success/customer-onboarding/SKILL.md,"Design structured customer onboarding programs — time-to-value optimization, activation milestones, kickoff calls, 30-60-90 day plans, handoff from sales to CS, onboarding playbooks by segment, and onboarding health tracking. Use when building customer onboarding, reducing time-to-value, designing kickoff process, or scaling onboarding from founder-led to team-led. Triggers on: ""customer onboarding"", ""time-to-value"", ""onboarding playbook"", ""kickoff call"", ""sales-to-CS handoff"".",medium,"Claude Code, Cursor, Codex, Hermes, Windsurf, OpenCode, Gemini CLI, Copilot, Zed, VS Code, Goose"
headless-support,headless-support,customer-success,skills/customer-success/headless-support/SKILL.md,"Design and deploy headless / automated support systems — AI chatbots, Fin AI agents, knowledge base self-serve portals, ticket deflection strategies, automated triage, email auto-responders, and conversational AI. Use when building self-serve support, implementing AI agents for tier-1 deflection, designing knowledge base architecture, or automating support workflows to scale CS without linear headcount growth.",medium,"Claude Code, Cursor, Codex, Hermes, Windsurf, OpenCode, Gemini CLI, Copilot, Zed, VS Code, Goose"
qbr-planning,qbr-planning,customer-success,skills/customer-success/qbr-planning/SKILL.md,"Plan and execute Quarterly Business Reviews — value documentation, ROI presentation, executive alignment, and expansion roadmap. Use when preparing for QBRs, business reviews with customers, or executive stakeholder meetings. Triggers on: ""QBR"", ""quarterly business review"", ""executive business review"", ""customer review"", ""value review"", or any request about strategic customer meetings.",medium,"Claude Code, Cursor, Codex, Hermes, Windsurf, OpenCode, Gemini CLI, Copilot, Zed, VS Code, Goose"
sla-management,sla-management,customer-success,skills/customer-success/sla-management/SKILL.md,"Design and manage customer support SLAs — service level agreements, ticket priority matrices, first response time targets, resolution time targets, escalation paths, business hours configuration, and SLA performance dashboards. Use when defining support SLAs, building tier-based service levels, designing escalation policies, or measuring SLA compliance. Triggers on: ""SLA design"", ""support SLAs"", ""escalation path"", ""ticket priority matrix"", ""first response time"", ""SLA compliance"".",medium,"Claude Code, Cursor, Codex, Hermes, Windsurf, OpenCode, Gemini CLI, Copilot, Zed, VS Code, Goose"
support-tool-stack,support-tool-stack,customer-success,skills/customer-success/support-tool-stack/SKILL.md,"Customer support platform selection, setup, and optimization — Intercom, Zendesk, Front, Help Scout, HubSpot Service Hub, Linear, and AI-native tools. Use when choosing a support platform, migrating tools, setting up help desk workflows, designing ticket routing, building macros and saved replies, or integrating support with CRM and product. Covers head-to-head comparison, pricing by stage, and implementation playbooks.",medium,"Claude Code, Cursor, Codex, Hermes, Windsurf, OpenCode, Gemini CLI, Copilot, Zed, VS Code, Goose"
content-syndication,content-syndication,demand-gen,skills/demand-gen/content-syndication/SKILL.md,"Plan and execute content syndication across paid and organic channels — content atomization using Ross Simmonds' distribution framework, NetLine- informed lead follow-up timing, syndication network economics, and channel-user fit mapping. Triggers on: ""content syndication"", ""content distribution"", ""syndication strategy"", ""promote content"", ""content amplification"", ""distribute our content"".",medium,"Claude Code, Cursor, Codex, Hermes, Windsurf, OpenCode, Gemini CLI, Copilot, Zed, VS Code, Goose"
paid-social-strategy,paid-social-strategy,demand-gen,skills/demand-gen/paid-social-strategy/SKILL.md,"B2B paid social strategy — LinkedIn, Meta, TikTok ad platform strategy, audience building, creative testing, budget allocation. Triggers on: ""paid social"", ""LinkedIn ads"", ""social advertising"", ""paid media strategy"", ""B2B ads"".",medium,"Claude Code, Cursor, Codex, Hermes, Windsurf, OpenCode, Gemini CLI, Copilot, Zed, VS Code, Goose"
podcast-gtm,podcast-gtm,demand-gen,skills/demand-gen/podcast-gtm/SKILL.md,"Use podcast appearances as a GTM channel — booking strategy, interview prep, content repurposing, pipeline conversion. Triggers on: ""podcast GTM"", ""podcast appearances"", ""be a podcast guest"", ""podcast marketing"".",medium,"Claude Code, Cursor, Codex, Hermes, Windsurf, OpenCode, Gemini CLI, Copilot, Zed, VS Code, Goose"
webinar-strategy,webinar-strategy,demand-gen,skills/demand-gen/webinar-strategy/SKILL.md,"Plan and execute demand gen webinars — topic selection, speaker sourcing, promotion cadence, follow-up sequences. Triggers on: ""webinar"", ""webinar strategy"", ""virtual event"", ""demand gen webinar"", ""webinar promotion"".",medium,"Claude Code, Cursor, Codex, Hermes, Windsurf, OpenCode, Gemini CLI, Copilot, Zed, VS Code, Goose"
battlecard-builder,battlecard-builder,design,skills/design/battlecard-builder/SKILL.md,"Create competitive battlecards — FIA Framework (Fact → Impact → Act), Why We Win/Why We Lose, objection handling cards per competitor, pricing comparisons, and quick-dismiss summaries. Use when building competitive intelligence, preparing for competitive deals, or creating sales enablement materials. Triggers on: ""battlecard"", ""competitive battlecard"", ""competitor comparison"", ""Why We Win"", ""objection handling card"", ""competitor intel"", or any competitive enablement.",medium,"Claude Code, Cursor, Codex, Hermes, Windsurf, OpenCode, Gemini CLI, Copilot, Zed, VS Code, Goose"
case-study-builder,case-study-builder,design,skills/design/case-study-builder/SKILL.md,"Create customer case studies in sales-ready format — Challenge→Solution→Results structure, before/after metrics, quote integration, two-length formats (1-page summary + full version). Use when creating case studies, customer success stories, proof content, or sales collateral. Triggers on: ""case study"", ""customer story"", ""success story"", ""proof content"", ""customer example"", ""results story"", or any request to document customer outcomes.",medium,"Claude Code, Cursor, Codex, Hermes, Windsurf, OpenCode, Gemini CLI, Copilot, Zed, VS Code, Goose"
design-system-gtm,design-system-gtm,design,skills/design/design-system-gtm/SKILL.md,"Define brand-context for AI agents — visual identity systems, voice/tone guides, color palettes with hex/RGB/HSL, typography systems with font stacks and type scales, logo usage rules, asset templates, and brand guardrails. Use when creating a design system for AI-generated GTM content, ensuring brand consistency across agent outputs, or implementing Google DESIGN.md specification. Includes Claude Code design patterns via claude-design skill.",medium,"Claude Code, Cursor, Codex, Hermes, Windsurf, OpenCode, Gemini CLI, Copilot, Zed, VS Code, Goose"
one-pager-builder,one-pager-builder,design,skills/design/one-pager-builder/SKILL.md,"Create one-page sales documents — product overviews, meeting leave-behinds, champion enablement sheets, trade show handouts. Scannable in 30 seconds, memorable enough to forward. Use when creating one-pagers, leave-behinds, quick reference sheets, or sales handouts. Triggers on: ""one-pager"", ""leave-behind"", ""product overview"", ""handout"", ""champion doc"", ""sales sheet"", or any request for a single-page sales document.",medium,"Claude Code, Cursor, Codex, Hermes, Windsurf, OpenCode, Gemini CLI, Copilot, Zed, VS Code, Goose"
pitch-deck-builder,pitch-deck-builder,design,skills/design/pitch-deck-builder/SKILL.md,"Build investor-ready pitch decks and sales presentations — 10-11 slide structure, persona-customized per role, storytelling frameworks, speaker notes, and visual direction. Use when creating pitch decks, sales decks, investor decks, board presentations, or any slide-based narrative. Triggers on: ""pitch deck"", ""sales deck"", ""investor deck"", ""presentation"", ""slide deck"", ""build a deck"", ""board deck"", or any request for a structured presentation.",medium,"Claude Code, Cursor, Codex, Hermes, Windsurf, OpenCode, Gemini CLI, Copilot, Zed, VS Code, Goose"
roi-calculator,roi-calculator,design,skills/design/roi-calculator/SKILL.md,"Build ROI calculators and business cases — 3-scenario projections (conservative, moderate, aggressive), payback period analysis, TCO comparison, assumption documentation, MEDDICC integration, value driver identification. Use when building ROI models, creating business cases, quantifying value for prospects, or supporting economic buyer conversations. Triggers on: ""ROI calculator"", ""business case"", ""ROI model"", ""value calculator"", ""TCO comparison"", ""payback period"", ""build the business case"".",medium,"Claude Code, Cursor, Codex, Hermes, Windsurf, OpenCode, Gemini CLI, Copilot, Zed, VS Code, Goose"
ui-ux-gtm,ui-ux-gtm,design,skills/design/ui-ux-gtm/SKILL.md,"Design GTM UI/UX patterns — landing pages (hero, proof, CTA), forms (progressive disclosure, inline validation), signup flows (activation, time-to-value), dashboards (KPI hierarchy, trend indicators), and accessibility (WCAG 2.1 AA). Use when designing or auditing GTM tool interfaces, landing pages, conversion flows, or onboarding experiences. Covers conversion-first design, mobile optimization, and A/B test readiness.",medium,"Claude Code, Cursor, Codex, Hermes, Windsurf, OpenCode, Gemini CLI, Copilot, Zed, VS Code, Goose"
conference-strategy,conference-strategy,events,skills/events/conference-strategy/SKILL.md,"Strategic conference planning — event selection, sponsorship ROI, speaking submissions, booth strategy, team preparation. Triggers on: ""conference strategy"", ""event planning"", ""trade show strategy"", ""sponsorship ROI"", ""CFP submissions"".",medium,"Claude Code, Cursor, Codex, Hermes, Windsurf, OpenCode, Gemini CLI, Copilot, Zed, VS Code, Goose"
event-driven-outreach,event-driven-outreach,events,skills/events/event-driven-outreach/SKILL.md,"Outbound sequences triggered by conference/event attendance — pre-event research, on-site plays, post-event follow-up. Triggers on: ""event outreach"", ""conference prospecting"", ""trade show follow-up"", ""event outbound"".",medium,"Claude Code, Cursor, Codex, Hermes, Windsurf, OpenCode, Gemini CLI, Copilot, Zed, VS Code, Goose"
field-marketing,field-marketing,events,skills/events/field-marketing/SKILL.md,"Plan and execute field marketing — regional events, executive dinners, roadshows, customer advisory boards. Triggers on: ""field marketing"", ""executive dinner"", ""roadshow"", ""regional event"", ""customer event"".",medium,"Claude Code, Cursor, Codex, Hermes, Windsurf, OpenCode, Gemini CLI, Copilot, Zed, VS Code, Goose"
buyer-psychology,buyer-psychology,foundation,skills/foundation/buyer-psychology/SKILL.md,"Apply decision science and buyer psychology to GTM — transparency effect (4.2-4.5), Cialdini principles, prediction over persuasion, trust mechanics. Use when designing messaging, building pitch decks, crafting positioning, or understanding why buyers buy. Triggers on: ""buyer psychology"", ""decision science"", ""why buyers buy"", ""transparency sale"", ""Cialdini"", ""trust selling"".",medium,"Claude Code, Cursor, Codex, Hermes, Windsurf, OpenCode, Gemini CLI, Copilot, Zed, VS Code, Goose"
competitive-intel,competitive-intel,foundation,skills/foundation/competitive-intel/SKILL.md,"Research competitors and turn findings into GTM assets: positioning map, win/loss themes, battlecard inputs, trap-setting questions, pricing comparison, and displacement angles. Use when evaluating a competitor, preparing sales enablement, building alternative pages, or entering a crowded category.",medium,"Claude Code, Cursor, Codex, Hermes, Windsurf, OpenCode, Gemini CLI, Copilot, Zed, VS Code, Goose"
gtm-context,gtm-context,foundation,skills/foundation/gtm-context/SKILL.md,"Capture reusable GTM context for every other skill: product, ICP, personas, pains, proof, competitors, pricing, channels, constraints, and source-of-truth files. Use when starting a project, onboarding an agent to a company, or fixing generic outputs caused by missing context.",medium,"Claude Code, Cursor, Codex, Hermes, Windsurf, OpenCode, Gemini CLI, Copilot, Zed, VS Code, Goose"
icp-scoring,icp-scoring,foundation,skills/foundation/icp-scoring/SKILL.md,"Score and tier ICP-fit accounts using firmographic, technographic, intent, pain, and timing signals. Produces a weighted ICP scorecard, tiering rules, anti-ICP exclusions, routing thresholds, and validation checklist. Use when defining target accounts, ranking TAM lists, prioritizing ABM accounts, or building fit scores.",medium,"Claude Code, Cursor, Codex, Hermes, Windsurf, OpenCode, Gemini CLI, Copilot, Zed, VS Code, Goose"
icp-targeting-tiers,icp-targeting-tiers,foundation,skills/foundation/icp-targeting-tiers/SKILL.md,"Define ICP differences across small business, mid-market, and enterprise — buying process, deal size, sales motion, tool stack, messaging by tier. Use when segmenting GTM by company size, designing tier-specific plays, or adapting messaging to buyer sophistication. Triggers on: ""ICP tiers"", ""small business vs enterprise"", ""mid-market ICP"", ""segment by company size"", ""SMB vs enterprise sales"", ""how to sell to small business"".",medium,"Claude Code, Cursor, Codex, Hermes, Windsurf, OpenCode, Gemini CLI, Copilot, Zed, VS Code, Goose"
positioning-messaging,positioning-messaging,foundation,skills/foundation/positioning-messaging/SKILL.md,"Build positioning and messaging from category, ICP, alternatives, differentiated value, proof, and buyer language. Produces a positioning statement, message hierarchy, persona messaging matrix, homepage narrative, and sales talk tracks. Use when messaging sounds generic, launches need positioning, or competitors blur differentiation.",medium,"Claude Code, Cursor, Codex, Hermes, Windsurf, OpenCode, Gemini CLI, Copilot, Zed, VS Code, Goose"
pricing-strategy,pricing-strategy,foundation,skills/foundation/pricing-strategy/SKILL.md,"Design SaaS pricing strategy using willingness-to-pay research, packaging, value metrics, competitive anchors, and expansion paths. Produces pricing hypotheses, package architecture, discount guardrails, and test plan. Use when setting prices, changing packages, evaluating usage-based pricing, or fixing monetization.",medium,"Claude Code, Cursor, Codex, Hermes, Windsurf, OpenCode, Gemini CLI, Copilot, Zed, VS Code, Goose"
using-gtm-skills,using-gtm-skills,foundation,skills/foundation/using-gtm-skills/SKILL.md,"Complete guide to using the gtm-skills repository — installation, skill discovery, skill loading, combining skills, taxonomy navigation, CLI workflows, and advanced patterns for every supported AI system (Claude Code, Jesse, Codex, Hermes, Windsurf, OpenCode, GitHub Copilot, Gemini CLI). The master key to the entire library. Use when first installing gtm-skills, discovering which skills to load, or building multi-skill workflows. Triggers on: ""gtm-skills"", ""install gtm-skills"", ""how to use gtm-skills"", ""skill discovery"", ""which skills to load"", ""getting started with skills"".",medium,"Claude Code, Cursor, Codex, Hermes, Windsurf, OpenCode, Gemini CLI, Copilot, Zed, VS Code, Goose"
advisor-recruitment,advisor-recruitment,founder-led,skills/founder-led/advisor-recruitment/SKILL.md,"Strategic advisor recruitment for B2B SaaS founders. Use when building advisory board, recruiting individual advisors, structuring advisor compensation (equity grants), defining advisory scope, leveraging advisors for intros/references/customers, and managing ongoing advisor relationships.",medium,"Claude Code, Cursor, Codex, Hermes, Windsurf, OpenCode, Gemini CLI, Copilot, Zed, VS Code, Goose"
board-meeting-prep,board-meeting-prep,founder-led,skills/founder-led/board-meeting-prep/SKILL.md,"Board meeting preparation for B2B SaaS founders. Use when preparing quarterly board meetings, building board decks, selecting metrics to present, crafting narrative, managing board relationships, or handling difficult board conversations (down rounds, missed targets, CEO transitions).",medium,"Claude Code, Cursor, Codex, Hermes, Windsurf, OpenCode, Gemini CLI, Copilot, Zed, VS Code, Goose"
brand-kit,brand-kit,founder-led,skills/founder-led/brand-kit/SKILL.md,"Build a complete brand kit for B2B SaaS — logo design and usage, color palette, typography, voice and tone, visual identity, brand guidelines, and asset templates. Use when creating a brand from scratch, rebranding, or building consistent visual identity. Triggers on: ""brand kit"", ""brand identity"", ""logo design"", ""brand guidelines"", ""visual identity"", ""brand book"", ""rebrand"", ""brand colors"", or any brand-building request.",medium,"Claude Code, Cursor, Codex, Hermes, Windsurf, OpenCode, Gemini CLI, Copilot, Zed, VS Code, Goose"
building-saas,building-saas,founder-led,skills/founder-led/building-saas/SKILL.md,"Build a SaaS company from idea to scale — product development, architecture decisions, pricing, hiring sequence, fundraising stages, and operational infrastructure. Use when starting a SaaS, scaling from $0 to $10M ARR, making build-vs-buy decisions, or designing the technical and operational foundation of a software business. Triggers on: ""build a SaaS"", ""start a SaaS"", ""SaaS architecture"", ""SaaS startup"", ""build software business"", ""SaaS from scratch"", ""tech stack for SaaS"", or any request about building a software company.",medium,"Claude Code, Cursor, Codex, Hermes, Windsurf, OpenCode, Gemini CLI, Copilot, Zed, VS Code, Goose"
business-insurance,business-insurance,founder-led,skills/founder-led/business-insurance/SKILL.md,"Complete business insurance guide for SaaS founders — Errors & Omissions (E&O/Tech E&O), Cyber Liability, Directors & Officers (D&O), General Liability, Workers Compensation, Key Person, Employment Practices Liability (EPLI), and when each becomes necessary. Covers what triggers insurance needs (first enterprise customer, fundraising, hiring), cost estimates by stage, and how to shop for coverage. Triggers on: ""business insurance"", ""startup insurance"", ""E&O insurance"", ""cyber insurance"", ""D&O insurance"".",medium,"Claude Code, Cursor, Codex, Hermes, Windsurf, OpenCode, Gemini CLI, Copilot, Zed, VS Code, Goose"
co-founder-dynamics,co-founder-dynamics,founder-led,skills/founder-led/co-founder-dynamics/SKILL.md,"Complete co-founder playbook for technical founders — finding co-founders, equity splits (dynamic and static), co-founder agreements, vesting schedules, working relationships, conflict resolution, co-founder breakups, and the ""dating before marrying"" framework. Use when looking for a co-founder, structuring a founding team, negotiating equity, or navigating co-founder relationship challenges. Covers YC advice, First Round, and a16z resources.",medium,"Claude Code, Cursor, Codex, Hermes, Windsurf, OpenCode, Gemini CLI, Copilot, Zed, VS Code, Goose"
content-led-growth,content-led-growth,founder-led,skills/founder-led/content-led-growth/SKILL.md,"Content-led growth strategy for B2B SaaS founders. Use when building a founder-led content engine, designing content as a GTM channel, scaling content production, measuring content ROI, repurposing across channels, or building a media brand that drives pipeline. Covers newsletter, social, long-form, podcast, and community channels.",medium,"Claude Code, Cursor, Codex, Hermes, Windsurf, OpenCode, Gemini CLI, Copilot, Zed, VS Code, Goose"
data-privacy-compliance,data-privacy-compliance,founder-led,skills/founder-led/data-privacy-compliance/SKILL.md,"Data privacy compliance for B2B SaaS — GDPR, CCPA/CPRA, ePrivacy Directive, cookie consent, Data Processing Agreements (DPAs), Standard Contractual Clauses (SCCs), Data Protection Impact Assessments (DPIAs), subject access requests (SARs), and privacy-by-design. Covers step-by-step compliance roadmap, privacy tech stack, and when to hire a DPO. Use when implementing GDPR compliance, preparing for enterprise security reviews, or building a privacy program. Triggers on: ""GDPR compliance"", ""CCPA"", ""data privacy"", ""DPA"", ""cookie consent"", ""privacy policy GDPR"", ""SCCs"", ""data protection"".",medium,"Claude Code, Cursor, Codex, Hermes, Windsurf, OpenCode, Gemini CLI, Copilot, Zed, VS Code, Goose"
employment-compliance,employment-compliance,founder-led,skills/founder-led/employment-compliance/SKILL.md,"Employment law and compliance for B2B SaaS founders — contractor vs employee classification, offer letters, IP assignment (PIIA), at-will employment, equity documentation, employee handbooks, harassment policies, termination procedures, and multi-state / international hiring compliance. Use when hiring first employees, classifying workers, building HR infrastructure, or expanding to new states/countries. Triggers on: ""employment law"", ""contractor vs employee"", ""offer letter"", ""employee handbook"", ""PIIA"", ""hiring compliance"", ""termination"".",medium,"Claude Code, Cursor, Codex, Hermes, Windsurf, OpenCode, Gemini CLI, Copilot, Zed, VS Code, Goose"
