slug,name,category,path,description,priority,compatibility
engineer-to-founder,engineer-to-founder,founder-led,skills/founder-led/engineer-to-founder/SKILL.md,"Engineer To Founder playbook for GTM agents — strategy, workflow, templates, operating guidance, and quality checks. Use when the user asks for engineer to founder work, implementation help, or an agent-ready deliverable.",medium,"Claude Code, Cursor, Codex, Hermes, Windsurf, OpenCode, Gemini CLI, Copilot, Zed, VS Code, Goose"
equity-management,equity-management,founder-led,skills/founder-led/equity-management/SKILL.md,"Complete equity management for SaaS founders — cap tables, 409A valuations, option pools (ISO vs NSO vs RSU), 83(b) elections, equity grants for employees/advisors/contractors, dilution modeling, secondary sales, and equity tools (Carta, Pulley, AngelList Equity). Use when setting up equity, granting options, planning option pools, modeling dilution, or preparing for fundraising. Triggers on: ""cap table"", ""409A valuation"", ""option pool"", ""equity grant"", ""ISO vs NSO"", ""83(b)"", ""equity for employees"".",medium,"Claude Code, Cursor, Codex, Hermes, Windsurf, OpenCode, Gemini CLI, Copilot, Zed, VS Code, Goose"
events-planning,events-planning,founder-led,skills/founder-led/events-planning/SKILL.md,"Plan and execute B2B events — conferences, webinars, dinners, happy hours, trade shows, and owned events. Use when planning any business event to generate pipeline or build community. Triggers on: ""event planning"", ""plan event"", ""host webinar"", ""conference strategy"", ""trade show"", ""customer dinner"", ""happy hour"", ""launch event"", or any event-related request.",medium,"Claude Code, Cursor, Codex, Hermes, Windsurf, OpenCode, Gemini CLI, Copilot, Zed, VS Code, Goose"
exiting-company,exiting-company,founder-led,skills/founder-led/exiting-company/SKILL.md,"Prepare a SaaS company for acquisition or exit — valuation drivers, due diligence readiness, financial preparation, legal structuring, and exit timeline. Use when planning an exit, preparing for acquisition, or maximizing company value for a future sale. Triggers on: ""exit strategy"", ""sell company"", ""acquisition prep"", ""M&A"", ""due diligence"", ""company valuation"", ""exit planning"", or any request about selling a business.",medium,"Claude Code, Cursor, Codex, Hermes, Windsurf, OpenCode, Gemini CLI, Copilot, Zed, VS Code, Goose"
financial-modeling,financial-modeling,founder-led,skills/founder-led/financial-modeling/SKILL.md,"SaaS financial modeling for founders — operating model, runway, headcount, DCF valuation, consumption-based pricing models, cohort analysis, unit economics by segment, ARR bridge/build, 3-scenario forecasting, and board-ready financials. Use when building financial model, projecting runway, modeling fundraising, valuation, or planning headcount. Covers discounted cash flow, consumption revenue models, expansion modeling, and SaaS-specific valuation.",medium,"Claude Code, Cursor, Codex, Hermes, Windsurf, OpenCode, Gemini CLI, Copilot, Zed, VS Code, Goose"
first-hires-playbook,first-hires-playbook,founder-led,skills/founder-led/first-hires-playbook/SKILL.md,"Complete playbook for founder's first 10 hires beyond sales. Use when hiring first engineer, first CS, first marketer, first product manager, or building founding team. Covers when to hire each role, job description architecture, compensation benchmarking, interview process design, and offer construction.",medium,"Claude Code, Cursor, Codex, Hermes, Windsurf, OpenCode, Gemini CLI, Copilot, Zed, VS Code, Goose"
founder-brand,founder-brand,founder-led,skills/founder-led/founder-brand/SKILL.md,"Build a founder personal brand — LinkedIn strategy, content cadence, podcast guesting, newsletter growth, media features, and community building. Use when building personal brand, growing audience, or establishing thought leadership as a founder. Triggers on: ""personal brand"", ""founder brand"", ""LinkedIn strategy"", ""thought leadership"", ""build audience"", ""get on podcasts"", ""newsletter growth"", or any founder content request.",medium,"Claude Code, Cursor, Codex, Hermes, Windsurf, OpenCode, Gemini CLI, Copilot, Zed, VS Code, Goose"
founder-sales,founder-sales,founder-led,skills/founder-led/founder-sales/SKILL.md,"Founder-led sales playbook for $0-5M ARR stages. Use when founder is primary seller, building sales process from scratch, transitioning from founder-led to AE-led, or designing demo/negotiation/close motions as a technical founder.",medium,"Claude Code, Cursor, Codex, Hermes, Windsurf, OpenCode, Gemini CLI, Copilot, Zed, VS Code, Goose"
fundraising-strategy,fundraising-strategy,founder-led,skills/founder-led/fundraising-strategy/SKILL.md,"Complete fundraising strategy for B2B SaaS founders. Use when preparing to raise seed/Series A, deciding VC vs bootstrapped path, building pitch deck, running a fundraise process, evaluating term sheets, or planning fundraising timeline. Covers SAFE, priced rounds, and bootstrapper alternatives.",medium,"Claude Code, Cursor, Codex, Hermes, Windsurf, OpenCode, Gemini CLI, Copilot, Zed, VS Code, Goose"
hiring-agencies,hiring-agencies,founder-led,skills/founder-led/hiring-agencies/SKILL.md,"Evaluate, hire, and manage agencies for SaaS GTM — outbound agencies, dev shops, marketing agencies, and design studios. When to use an agency vs hiring in-house, how to structure engagements, and how to measure ROI. Triggers on: ""hire agency"", ""outbound agency"", ""dev shop"", ""marketing agency"", ""agency vs in-house"", ""outsource GTM"", or any agency hiring request.",medium,"Claude Code, Cursor, Codex, Hermes, Windsurf, OpenCode, Gemini CLI, Copilot, Zed, VS Code, Goose"
hiring-by-role,hiring-by-role,founder-led,skills/founder-led/hiring-by-role/SKILL.md,"Role-specific hiring guides for B2B SaaS — interview questions, evaluation criteria, scorecards, and assessment methods for engineering, sales, marketing, customer success, product, and design roles. Based on best practices from Betts Recruiting, Bridge Group, SaaStr, YC, and Google re:Work. Use when building an interview process for a specific role or evaluating candidates systematically. Triggers on: ""interview questions for [role]"", ""how to hire [role]"", ""scorecard for [role]"", ""evaluate [role] candidates"".",medium,"Claude Code, Cursor, Codex, Hermes, Windsurf, OpenCode, Gemini CLI, Copilot, Zed, VS Code, Goose"
hiring-contractors,hiring-contractors,founder-led,skills/founder-led/hiring-contractors/SKILL.md,"Hire and manage contractors for SaaS startups — where to find them, how to structure engagements, IP assignment, rates by role, and management practices that produce quality work without full-time overhead. Use when hiring freelance developers, designers, writers, or any contract talent. Triggers on: ""hire contractor"", ""freelance developer"", ""contract work"", ""outsource development"", ""find a designer"", ""contract vs employee"", or any contractor hiring request.",medium,"Claude Code, Cursor, Codex, Hermes, Windsurf, OpenCode, Gemini CLI, Copilot, Zed, VS Code, Goose"
investor-updates,investor-updates,founder-led,skills/founder-led/investor-updates/SKILL.md,"Write investor updates that build confidence and surface help — monthly format, board deck structure, fundraising narrative, and metrics dashboards. Use when writing investor updates, preparing board meetings, or communicating with stakeholders. Triggers on: ""investor update"", ""board deck"", ""monthly update"", ""investor communication"", ""fundraising update"", or any stakeholder reporting.",medium,"Claude Code, Cursor, Codex, Hermes, Windsurf, OpenCode, Gemini CLI, Copilot, Zed, VS Code, Goose"
job-posting-strategy,job-posting-strategy,founder-led,skills/founder-led/job-posting-strategy/SKILL.md,"Complete job posting and distribution strategy for B2B SaaS companies — where to post by role (engineering, sales, marketing, CS, product, design), job board comparison, posting templates, sourcing channels, and expert recruiting strategies. References Betts Recruiting, SaaStr, YC, and Bridge Group data. Use when hiring for any role and determining where to find the best candidates. Triggers on: ""job posting"", ""where to post jobs"", ""job boards"", ""recruiting strategy"", ""sourcing candidates"".",medium,"Claude Code, Cursor, Codex, Hermes, Windsurf, OpenCode, Gemini CLI, Copilot, Zed, VS Code, Goose"
launch-planning,launch-planning,founder-led,skills/founder-led/launch-planning/SKILL.md,"Launch Planning playbook for GTM agents — strategy, workflow, templates, operating guidance, and quality checks. Use when the user asks for launch planning work, implementation help, or an agent-ready deliverable.",medium,"Claude Code, Cursor, Codex, Hermes, Windsurf, OpenCode, Gemini CLI, Copilot, Zed, VS Code, Goose"
lead-magnets,lead-magnets,founder-led,skills/founder-led/lead-magnets/SKILL.md,"Lead Magnets playbook for GTM agents — strategy, workflow, templates, operating guidance, and quality checks. Use when the user asks for lead magnets work, implementation help, or an agent-ready deliverable.",medium,"Claude Code, Cursor, Codex, Hermes, Windsurf, OpenCode, Gemini CLI, Copilot, Zed, VS Code, Goose"
legal-for-founders,legal-for-founders,founder-led,skills/founder-led/legal-for-founders/SKILL.md,"Complete legal playbook for SaaS founders — incorporation (Delaware C-Corp vs LLC), IP assignment, Terms of Service, Privacy Policy, NDAs, consulting agreements, co-founder IP, fundraising legal (SAFE, priced round, board consents), and when to hire a lawyer. Step-by-step checklists with YC, CooleyGO, Clerky, and Orrick resources. Triggers on: ""legal for startup"", ""incorporate"", ""Terms of Service"", ""Privacy Policy"", ""NDA"", ""SAFE"", ""startup legal"", ""founder legal basics"".",medium,"Claude Code, Cursor, Codex, Hermes, Windsurf, OpenCode, Gemini CLI, Copilot, Zed, VS Code, Goose"
partner-programs,partner-programs,founder-led,skills/founder-led/partner-programs/SKILL.md,"Partner Programs playbook for GTM agents — strategy, workflow, templates, operating guidance, and quality checks. Use when the user asks for partner programs work, implementation help, or an agent-ready deliverable.",medium,"Claude Code, Cursor, Codex, Hermes, Windsurf, OpenCode, Gemini CLI, Copilot, Zed, VS Code, Goose"
pricing-psychology,pricing-psychology,founder-led,skills/founder-led/pricing-psychology/SKILL.md,"SaaS pricing psychology and tactics for B2B founders. Use when designing pricing tiers, testing price points, building pricing pages, handling discounting strategy, adding new pricing dimensions, or optimizing monetization. Covers anchoring, decoy effect, charm pricing, framing, versioning, and willingness-to-pay research methodology.",medium,"Claude Code, Cursor, Codex, Hermes, Windsurf, OpenCode, Gemini CLI, Copilot, Zed, VS Code, Goose"
saas-metrics-calculator,saas-metrics-calculator,founder-led,skills/founder-led/saas-metrics-calculator/SKILL.md,"Saas Metrics Calculator playbook for GTM agents — strategy, workflow, templates, operating guidance, and quality checks. Use when the user asks for saas metrics calculator work, implementation help, or an agent-ready deliverable.",medium,"Claude Code, Cursor, Codex, Hermes, Windsurf, OpenCode, Gemini CLI, Copilot, Zed, VS Code, Goose"
sales-team-building,sales-team-building,founder-led,skills/founder-led/sales-team-building/SKILL.md,"Build a B2B sales team from first hire to scale — hiring sequence by ARR stage, WbD POD structures, compensation models (linear/accelerated/split), draw mechanics, REKS coaching, and WbD GTM Index for scaling readiness. Use when planning first sales hire, designing sales org, or scaling a team. Triggers on: ""build sales team"", ""first sales hire"", ""sales org design"", ""sales compensation"", ""sales POD"", ""scale sales team"", ""hire AE"", ""hire SDR"", or any sales team building request.",medium,"Claude Code, Cursor, Codex, Hermes, Windsurf, OpenCode, Gemini CLI, Copilot, Zed, VS Code, Goose"
security-assessments,security-assessments,founder-led,skills/founder-led/security-assessments/SKILL.md,"Security assessment and vendor risk management for B2B SaaS — penetration testing, vulnerability scanning, bug bounty programs, security questionnaires (VSAQ/SIG/CAIQ), incident response planning, disaster recovery, and passing enterprise security reviews. Use when responding to vendor security assessments, preparing for enterprise procurement, or building a security program. Triggers on: ""security assessment"", ""penetration test"", ""bug bounty"", ""security questionnaire"", ""VSAQ"", ""incident response"", ""vendor review"".",medium,"Claude Code, Cursor, Codex, Hermes, Windsurf, OpenCode, Gemini CLI, Copilot, Zed, VS Code, Goose"
soc2-compliance,soc2-compliance,founder-led,skills/founder-led/soc2-compliance/SKILL.md,"Achieve SOC2 Type II compliance for SaaS companies — readiness assessment, control implementation, auditor selection, evidence collection, and ongoing monitoring. Use when preparing for SOC2, responding to enterprise security questionnaires, or building a compliance program. Triggers on: ""SOC2"", ""SOC 2"", ""compliance"", ""security audit"", ""enterprise security"", ""security questionnaire"", ""Type II"", or any request about security compliance for SaaS.",medium,"Claude Code, Cursor, Codex, Hermes, Windsurf, OpenCode, Gemini CLI, Copilot, Zed, VS Code, Goose"
solo-founder-gtm,solo-founder-gtm,founder-led,skills/founder-led/solo-founder-gtm/SKILL.md,"Build lean GTM as a solo founder or bootstrapper — tool stacks by revenue stage, AI agents replacing headcount, when to make the first hire, bootstrapper economics, and the WbD GTM Index for self-assessment. Use when building GTM as a solo founder, bootstrapper, or small team. Triggers on: ""solo founder"", ""bootstrapper GTM"", ""lean GTM"", ""founder sales"", ""DIY GTM"", ""when to hire"", ""founder tools"", ""bootstrapped stack"", or any request about building GTM without a team.",medium,"Claude Code, Cursor, Codex, Hermes, Windsurf, OpenCode, Gemini CLI, Copilot, Zed, VS Code, Goose"
startup-communities,startup-communities,founder-led,skills/founder-led/startup-communities/SKILL.md,"Startup Communities playbook for GTM agents — strategy, workflow, templates, operating guidance, and quality checks. Use when the user asks for startup communities work, implementation help, or an agent-ready deliverable.",medium,"Claude Code, Cursor, Codex, Hermes, Windsurf, OpenCode, Gemini CLI, Copilot, Zed, VS Code, Goose"
vc-outreach,vc-outreach,founder-led,skills/founder-led/vc-outreach/SKILL.md,"Vc Outreach playbook for GTM agents — strategy, workflow, templates, operating guidance, and quality checks. Use when the user asks for vc outreach work, implementation help, or an agent-ready deliverable.",medium,"Claude Code, Cursor, Codex, Hermes, Windsurf, OpenCode, Gemini CLI, Copilot, Zed, VS Code, Goose"
vendor-contracts,vendor-contracts,founder-led,skills/founder-led/vendor-contracts/SKILL.md,"Vendor contracts, MSAs, DPAs, and procurement for B2B SaaS — master service agreements, service level agreements, data processing agreements, order forms, vendor security assessments, and contract negotiation playbooks. Use when selling to enterprise (inbound contracts), buying from vendors (outbound procurement), negotiating terms, or building standard agreement templates. Triggers on: ""MSA"", ""SLA agreement"", ""data processing agreement"", ""order form"", ""vendor security review"", ""enterprise contract"", ""procurement"".",medium,"Claude Code, Cursor, Codex, Hermes, Windsurf, OpenCode, Gemini CLI, Copilot, Zed, VS Code, Goose"
yc-ecosystem,yc-ecosystem,founder-led,skills/founder-led/yc-ecosystem/SKILL.md,"Yc Ecosystem playbook for GTM agents — strategy, workflow, templates, operating guidance, and quality checks. Use when the user asks for yc ecosystem work, implementation help, or an agent-ready deliverable.",medium,"Claude Code, Cursor, Codex, Hermes, Windsurf, OpenCode, Gemini CLI, Copilot, Zed, VS Code, Goose"
churn-prevention,churn-prevention,growth,skills/growth/churn-prevention/SKILL.md,"Build churn prevention systems — early warning signal detection, customer health scoring, re-engagement campaigns, risk tier routing, and champion departure monitoring. Use when reducing churn, building retention systems, detecting at-risk customers, or designing proactive customer success workflows. Triggers on: ""churn prevention"", ""reduce churn"", ""at-risk customers"", ""health score"", ""customer retention"", ""churn prediction"", ""save customers"", ""re-engagement"", or any request about keeping customers from canceling.",medium,"Claude Code, Cursor, Codex, Hermes, Windsurf, OpenCode, Gemini CLI, Copilot, Zed, VS Code, Goose"
customer-marketing,customer-marketing,growth,skills/growth/customer-marketing/SKILL.md,"Customer marketing and advocacy programs — case studies, testimonials, customer reference programs, NPS-driven advocacy, customer communities, user conferences, champion programs, logo usage, and review generation (G2, Capterra). Use when building customer marketing, generating case studies, launching a reference program, or mobilizing customer advocates.",medium,"Claude Code, Cursor, Codex, Hermes, Windsurf, OpenCode, Gemini CLI, Copilot, Zed, VS Code, Goose"
expansion-selling,expansion-selling,growth,skills/growth/expansion-selling/SKILL.md,"Complete expansion and upsell playbook for B2B SaaS — consumption-based upsell triggers, cross-sell identification, seat expansion, tier upgrades, NRR growth strategies, land-and-expand motions, expansion propensity scoring, and measuring expansion revenue. Use when designing expansion motions, identifying upsell opportunities, or growing NRR. Triggers on: ""expansion selling"", ""upsell strategy"", ""NRR growth"", ""land and expand"", ""cross-sell"", ""expansion revenue"", ""seat expansion"".",medium,"Claude Code, Cursor, Codex, Hermes, Windsurf, OpenCode, Gemini CLI, Copilot, Zed, VS Code, Goose"
referral-programs,referral-programs,growth,skills/growth/referral-programs/SKILL.md,"Design customer and partner referral programs — 3-tier comp structure, referral tracking, platform integration, double-sided rewards, viral mechanics, referral leaderboards, and measuring referral revenue. Use when building a referral program, designing referral incentives, or launching a customer referral engine. Triggers on: ""referral program"", ""referral marketing"", ""customer referrals"", ""partner referrals"".",medium,"Claude Code, Cursor, Codex, Hermes, Windsurf, OpenCode, Gemini CLI, Copilot, Zed, VS Code, Goose"
campaign-governance,campaign-governance,gtm-ops,skills/gtm-ops/campaign-governance/SKILL.md,"Establish campaign governance — naming conventions, UTM parameters, campaign hierarchy, ROI measurement, budget tracking. Triggers on: ""campaign governance"", ""UTM strategy"", ""campaign naming"", ""marketing ops governance"".",medium,"Claude Code, Cursor, Codex, Hermes, Windsurf, OpenCode, Gemini CLI, Copilot, Zed, VS Code, Goose"
gtm-operations,gtm-operations,gtm-ops,skills/gtm-ops/gtm-operations/SKILL.md,"Build GTM operations function — tech stack architecture, process design, data governance, RevOps foundations. Triggers on: ""GTM ops"", ""RevOps"", ""revenue operations"", ""sales ops"", ""GTM infrastructure"".",medium,"Claude Code, Cursor, Codex, Hermes, Windsurf, OpenCode, Gemini CLI, Copilot, Zed, VS Code, Goose"
revops-tech-stack,revops-tech-stack,gtm-ops,skills/gtm-ops/revops-tech-stack/SKILL.md,"Design the RevOps technology stack — CRM, enrichment, sequencing, analytics, integration architecture. Triggers on: ""RevOps stack"", ""sales tech stack"", ""GTM tool audit"", ""revenue technology"".",medium,"Claude Code, Cursor, Codex, Hermes, Windsurf, OpenCode, Gemini CLI, Copilot, Zed, VS Code, Goose"
content-marketing,content-marketing,inbound,skills/inbound/content-marketing/SKILL.md,"Build content marketing strategies that generate pipeline — SEO/AEO optimization, pillar page design, programmatic SEO, content-to-pipeline mapping. Use when the user wants to plan content strategy, build a content calendar, improve SEO, create pillar content, or generate pipeline from content. Triggers on: ""content marketing"", ""SEO strategy"", ""content strategy"", ""blog"", ""pillar page"", ""content calendar"", ""AEO"", ""AI search optimization"", ""programmatic SEO"", or any request about content-driven growth.",medium,"Claude Code, Cursor, Codex, Hermes, Windsurf, OpenCode, Gemini CLI, Copilot, Zed, VS Code, Goose"
inbound-triage,inbound-triage,inbound,skills/inbound/inbound-triage/SKILL.md,"Design inbound lead triage workflows — demo form qualification, MQL to SQL routing, automated enrichment on form fill, speed-to-lead SLAs. Use when the user wants to handle inbound leads, route demo requests, qualify form fills, or build an inbound pipeline. Triggers on: ""inbound triage"", ""demo request"", ""lead routing"", ""MQL"", ""SQL"", ""speed to lead"", ""form qualification"", ""inbound process"", ""qualify inbound leads"", or any request about handling incoming leads.",medium,"Claude Code, Cursor, Codex, Hermes, Windsurf, OpenCode, Gemini CLI, Copilot, Zed, VS Code, Goose"
landing-pages,landing-pages,inbound,skills/inbound/landing-pages/SKILL.md,"Audit and optimize landing pages for conversion — hero/offer/proof/CTA patterns, CRO audits, A/B testing, signup flow optimization. Use when the user wants to improve conversion rates, audit a landing page, optimize a signup flow, or increase demo requests. Triggers on: ""landing page"", ""conversion rate"", ""CRO"", ""optimize page"", ""signup flow"", ""conversion optimization"", ""hero section"", ""improve conversions"", ""A/B test landing"", or any request about improving page conversion.",medium,"Claude Code, Cursor, Codex, Hermes, Windsurf, OpenCode, Gemini CLI, Copilot, Zed, VS Code, Goose"
social-selling,social-selling,inbound,skills/inbound/social-selling/SKILL.md,"Build a LinkedIn social selling strategy — Sales Navigator, DM sequences, content-to-conversation, profile optimization, and SSI scoring. Use when the user wants to sell on LinkedIn, build a LinkedIn presence, use Sales Navigator, or generate pipeline from social. Triggers on: ""LinkedIn selling"", ""social selling"", ""Sales Navigator"", ""LinkedIn outreach"", ""LinkedIn DMs"", ""profile optimization"", ""SSI"", ""LinkedIn strategy"", or any request about LinkedIn for sales.",medium,"Claude Code, Cursor, Codex, Hermes, Windsurf, OpenCode, Gemini CLI, Copilot, Zed, VS Code, Goose"
leadmagic-bulk-enrichment,leadmagic-bulk-enrichment,leadmagic,skills/leadmagic/leadmagic-bulk-enrichment/SKILL.md,"Process CSV files with LeadMagic at scale — input cleanup, batch sizing, validation status handling, webhook callbacks, CRM export, error recovery, and quality checks. Use when enriching a list, bulk validating contacts, or pushing LeadMagic-enriched data into GTM systems.",medium,"Claude Code, Cursor, Codex, Hermes, Windsurf, OpenCode, Gemini CLI, Copilot, Zed, VS Code, Goose"
leadmagic-cli,leadmagic-cli,leadmagic,skills/leadmagic/leadmagic-cli/SKILL.md,"Use the LeadMagic CLI for enrichment automation — find emails, validate contacts, enrich CSVs in batch, find decision-makers by role, and push to outbound platforms (Smartlead, Instantly). Use when automating enrichment from the command line, batch-processing contacts, or integrating LeadMagic into scripts. Triggers on: ""LeadMagic CLI"", ""lm find"", ""lm validate"", ""lm enrich"", ""LeadMagic command line"", or any request about CLI-based enrichment.",medium,"Claude Code, Cursor, Codex, Hermes, Windsurf, OpenCode, Gemini CLI, Copilot, Zed, VS Code, Goose"
leadmagic-integrations,leadmagic-integrations,leadmagic,skills/leadmagic/leadmagic-integrations/SKILL.md,"Integrate LeadMagic with GTM platforms — Clay, Apollo, Smartlead, Instantly, Salesforce, HubSpot, Zapier, Make. Bi-directional data flows, webhook enrichment, CRM automation, and verification-at-send patterns. Use when connecting LeadMagic to your GTM stack. Triggers on: ""LeadMagic integration"", ""connect LeadMagic to"", ""LeadMagic + Clay"", ""LeadMagic + HubSpot"", ""LeadMagic + Salesforce"", or any platform integration request.",medium,"Claude Code, Cursor, Codex, Hermes, Windsurf, OpenCode, Gemini CLI, Copilot, Zed, VS Code, Goose"
leadmagic-job-change,leadmagic-job-change,leadmagic,skills/leadmagic/leadmagic-job-change/SKILL.md,"Use LeadMagic job-change signals for pipeline intelligence — champion tracking, account risk alerts, new-role outreach, replacement mapping, and CRM routing. Use when monitoring career moves or building trigger-based sales plays.",medium,"Claude Code, Cursor, Codex, Hermes, Windsurf, OpenCode, Gemini CLI, Copilot, Zed, VS Code, Goose"
leadmagic-mcp,leadmagic-mcp,leadmagic,skills/leadmagic/leadmagic-mcp/SKILL.md,"Set up LeadMagic MCP for AI agents — tool discovery, permission scope, safe enrichment workflows, batch usage, verification steps, and agent handoff patterns. Use when connecting LeadMagic data tools to Claude, Cursor, VS Code, or any MCP compatible client.",medium,"Claude Code, Cursor, Codex, Hermes, Windsurf, OpenCode, Gemini CLI, Copilot, Zed, VS Code, Goose"
